,items__volumeInfo__title,items__volumeInfo__subtitle,items__volumeInfo__authors__001,items__volumeInfo__description,items__volumeInfo__industryIdentifiers__identifier,title
200,A Digest of Equity (Classic Reprint),,J. Andrew Strahan,"Excerpt from A Digest of Equity Owing to the absence of Mr. Kenrick in India, this Edition has had to be prepared without the benefit of his assistance. The substantial alterations are that Book I., dealing with the Jurisdiction of Chancery, has been recast and enlarged, and that to Book II. three new Articles have been added on Married Women's and Infants' Property. As regards the part from Mr. Kenrick's pen (Sections I. to V. of Book III.), Mr. Strahan, save for deleting two Articles which the enlargement of Book I. rendered superfluous and some of the authorities cited which seemed to him too numerous for a student's book, has done no more than bring it up to date. Mr. Strahan has to thank many gentlemen for suggestions and criticisms, and especially his friend and former pupil, Mr. Norman Oldham, of the Inner Temple, Barrister-at-Law, who was also kind enough to read the proofs. About the Publisher Forgotten Books publishes hundreds of thousands of rare and classic books. Find more at www.forgottenbooks.com This book is a reproduction of an important historical work. Forgotten Books uses state-of-the-art technology to digitally reconstruct the work, preserving the original format whilst repairing imperfections present in the aged copy. In rare cases, an imperfection in the original, such as a blemish or missing page, may be replicated in our edition. We do, however, repair the vast majority of imperfections successfully; any imperfections that remain are intentionally left to preserve the state of such historical works.",0428865100,
202,The Law of Trusts,,James Penner,"The Core Text Series takes the reader straight to the heart of the subject, providing a reliable and invaluable guide for students of law at all levels. Written by leading academics and renowned for their clarity, these concise texts explain the intellectual challenges of each area of the law. The Law of Trusts provides a concise, yet academically rigorous, textbook that skilfully engages with both controversial and complex issues within the subject. James Penner provides perceptive analysis and original and thought-provoking commentary to give students an excellent grounding in what is considered to be a challenging subject. Drawing on a variety of learning features, including summaries of key issues discussed in each chapter, must-read cases, assessment questions, and carefully selected further reading, this approachable and thorough textbook equips students with the tools they need to engage critically with the subject.",9780198747598,
204,Key Cases: Equity & Trusts,,Judith Bray,The Key Cases series provides a portable and effective way for you to absorb and retain the essential facts needed to pass your exams effortlessly.,9781444137835,
206,Equity in Commercial Law,,Simone Degeling,"Based on the papers presented at ""Fusion: The Interaction of Common Law & Equity in Commercial Law"", this book brings together in one volume a series of chapters from a team of prestigious contributors analysing the interaction of common law and equity in commercial law. The editors have specifically chosen commentaries that reflect current problems in legal analysis from the viewpoint of commercial legal practitioners. Providing a rigorous discussion of the emerging cases and trends in commercial law, this work of exceptional legal scholarship presents a compelling offering for judges, barristers, academics, commercial litigators and anyone interested in where the law is heading in this area. The collection provides access to views from the world's leading commentators in this field including esteemed judges, legal practitioners and academics from Australia, Canada, England, Ireland and New Zealand.",0455222088,
214,Equity and Law,,John C. P. Goldberg,"The fusion of law and equity in common law systems was a crucial moment in the development of the modern law. In this volume leading scholars assess the significance of the fusion of law and equity from comparative, doctrinal, historical and theoretical perspectives.",9781108421317,
216,Equity in English Renaissance Literature,Thomas More and Edmund Spenser,Andrew J. Majeske,"This book accounts for the previously inadequately explained transformation in the meaning of equity in sixteenth century England, a transformation which, intriguingly, first comes to light in literary texts rather than political or legal treatises. The book address the two principal literary works in which the transformation becomes apparent, Thomas More's Utopia and Edmund Spenser's Faerie Queene, and sketches the history of equity to its roots in the Greek concept of epieikeia, uncovering along the way both previously unexplained distinctions, and a long-obscured esoteric meaning. These rediscoveries, when brought to bear upon the Utopia and Faerie Queene, illuminate critical though relatively neglected textual passages that have long puzzled scholars.",9780415977050,Equity in English Renaissance Literature Thomas More and Edmund Spenser
224,Mixed - An Inspiring Story about Colour,,Arree Chung,"The Blues, Reds and Yellows lived in harmony. Reds were the loudest, Yellows the brightest and Blues were the coolest. However when one of the colours proclaims they are the best, discord breaks out and eventually the colours decide to live in different parts of the city. Then one day a Yellow befriends a Blue and they become inseparable, discovering a world of different possibilities and colours. From the brilliantly talented Arree Chung comes a sweet tale of difference and acceptance. Mixed is a charming and timely story with characterful illustrations and humour.",1509871330,
226,Pink Tiara Cookies for Three,,Maria Dismondy,"When Jasmine moves in across the street, best friends Sami and Stella learn to make room for one more friend.",0615516203,
228,Landscapes of Music in Istanbul,A Cultural Politics of Place and Exclusion,Alex G. Papadopoulos,"Biographical note: Alex Papadopoulos is Associate Professor of Geography at DePaul University, Chicago. He studies the contestation of urban space in European cities.Asli Duru is Marie Curie Fellow at The Open University, London, and studies everyday geographies of health and wellbeing.",3837633586,Landscapes of Music in Istanbul A Cultural Politics of Place and Exclusion
234,Assessing the Perceived and Actual Use of Evidence-based Interventions for Children with Autism Spectrum Disorders in General Education Preschool Programs,,Shanna E. Reese,This study examined relationships between rate of intervention use and hours of professional development training and specific education on the included interventions.,OCLC:1047961182,
235,Adventures of Little Blacky Up to the Mountain,,Galina Dovich,"This is the second story about Little Blacky, the black lamb, who was born into a flock of white sheep. In the first story, A Cure For Blind Hearts, he was looking for his place in the world and in his flock, and was answering the important questions: What does it mean to be different? Is it right to be unlike the others? Can we judge by looks? Meet Little Blacky again and join him in his new journey. This time he is chasing one of his dreams, which is to become as white as the other sheep in the flock. Read this story and find out whether he realizes his dream. Learn what new friends he meets on his way. This is a fun and touching story about friendship, diversity and inclusion.",OCLC:1195949394,
