,items__volumeInfo__title,items__volumeInfo__subtitle,items__volumeInfo__authors__001,items__volumeInfo__description,items__volumeInfo__industryIdentifiers__identifier,title
1054,On Intersectionality,Essential Writings,Kimberlé Crenshaw,"A major publishing event, the collected writings of the groundbreaking scholar who “first coined intersectionality as a political framework” (Salon) For more than twenty years, scholars, activists, educators, and lawyers—inside and outside of the United States—have employed the concept of intersectionality both to describe problems of inequality and to fashion concrete solutions. In particular, as the Washington Post reported recently, “the term has been used by social activists as both a rallying cry for more expansive progressive movements and a chastisement for their limitations.” Drawing on black feminist and critical legal theory, Kimberlé Crenshaw developed the concept of intersectionality, a term she coined to speak to the multiple social forces, social identities, and ideological instruments through which power and disadvantage are expressed and legitimized. In this comprehensive and accessible introduction to Crenshaw’s work, readers will find key essays and articles that have defined the concept of intersectionality, collected together for the first time. The book includes a sweeping new introduction by Crenshaw as well as prefaces that contextualize each of the chapters. For anyone interested in movement politics and advocacy, or in racial justice and gender equity, On Intersectionality will be compulsory reading from one of the most brilliant theorists of our time.",9781620972717,On Intersectionality Essential Writings
1056,"Intersectionality of Race, Ethnicity, Class, and Gender in Teaching and Teacher Education",Movement toward Equity in Education,Norvella P. Carter,"Intersectionality of Race, Ethnicity, Class, and Gender in Teaching and Teacher Education brings together scholarship that employs an intersectionality methodology to actual conditions that affect school-age children, teachers and teacher educators in relation to institutional systems of power and privilege.",9789004365209,"Intersectionality of Race, Ethnicity, Class, and Gender in Teaching and Teacher Education Movement toward Equity in Education"
1058,Intersectionality in Anglophone Television Series and Cinema,,Kévin Drif,"This book takes an intersectional approach to explore gender, race, ethnicity and social class in television series and films produced by English-speaking countries. Starting from Kimberlé Crenshaw’s 1989 concept of intersectionality, and encompassing film studies, television studies, cultural studies, gender studies, Queer theory, African American studies, and post-colonial studies, this volume sheds light not only on revealing intersectional elements of on-screen fiction, but also on the very nature of intersectional criticism.",9781527560932,
1060,Intersectionality,An Intellectual History,Ange-Marie Hancock,"""Though intersectionality theory has emerged as a highly influential school of thought in ethnic studies, gender studies, law, political science, sociology and psychology, no scholarship to date exists on the evolution of the theory. This book seeks to remedy the gap by attending to the historical, geographical, and cross-disciplinary myopia afflicting current intersectionality scholarship. This comprehensive intellectual history will be an agenda-setting work for the theory""--",9780199370375,Intersectionality An Intellectual History
1062,De-Whitening Intersectionality,"Race, Intercultural Communication, and Politics",Dr. Shinsuke Eguchi,"De-Whitening Intersectionality: Race, Intercultural Communication, and Politics re-evaluates how the logic of color-blindness as whiteness is at play in the current scope of intersectional research on race, intercultural communication, and politics. Calling for a re-centering of difference by exploring the emergence and inception of intersectionality concepts, the coeditors and contributors distinguish between the uses of intersectionality that seem inclusive versus those that actually enact inclusion by demonstrating how to re-conceptualize intersectionality in ways that explicate, elucidate, and elaborate culture-specific and text-specific nuances of knowledge for women of color, queer/trans-people of color, and non-western people of color who have been marked as the Others. As a feminist of color tradition, intersectionality has been appropriated through increasing popularity in the discipline of communication, undermining efforts to critique power when researchers reduce the concept to a checklist of identity markers. This book underscores that in order to play well with and illustrate a nuanced understanding of intersectionality; scholars must be attentive to its origins and implications.",9781498588232,"De-Whitening Intersectionality Race, Intercultural Communication, and Politics"
1064,Intersectionality and Comparative Antidiscrimination Law,The Tale of Two Citadels,Shreya Atrey,"This volume in the Brill Research Perspectives in Comparative Discrimination Law addresses intersectionality from the lens of comparative antidiscrimination law. The term ‘intersectionality’ was coined by Kimberlé Williams Crenshaw in 1989. As a field, intersectionality has a longer history, of nearly two hundred years. Meanwhile, comparative antidiscrimination law as a field may be just over a few decades old. Thus, intersectionality’s tryst with antidiscrimination law is a fairly recent one. Developed as a critique of antidiscrimination law, intersectionality has had a significant influence on it. Yet, intersectionality’s logic does not seem to have infiltrated the logic of antidiscrimination law completely. Comparative antidiscrimination law continues to develop with intersectionality in sight, but rarely, in step. On the occasion of the 30th anniversary of Crenshaw’s seminal article that coined the term in the context of antidiscrimination law, Shreya Atrey explores this irony. Her article provides a meta-narrative of the development of the two fields with the purpose of showing what appear to be orthogonal trajectories.",9789004382862,Intersectionality and Comparative Antidiscrimination Law The Tale of Two Citadels
1066,Marxism and Intersectionality,"Race, Gender, Class and Sexuality under Contemporary Capitalism",Ashley J. Bohrer,"What does the development of a truly robust contemporary theory of domination require? Ashley J. Bohrer argues that it is only by considering all of the dimensions of race, gender, sexuality, and class within the structures of capitalism and imperialism that we can understand power relations as we find them nowadays. Bohrer explains how many of the purported incompatibilities between Marxism and intersectionality arise more from miscommunication rather than a fundamental conceptual antagonism. As the first monograph entirely devoted to this issue, »Marxism and Intersectionality« serves as a tool to activists and academics working against multiple systems of domination, exploitation, and oppression.",9783839441602,"Marxism and Intersectionality Race, Gender, Class and Sexuality under Contemporary Capitalism"
1068,The Palgrave Handbook of Intersectionality in Public Policy,,Olena Hankivsky,"Grounded in black feminist scholarship and activism and formally coined in 1989 by black legal scholar Kimberlé Williams Crenshaw, intersectionality has garnered significant attention in the field of public policy and other disciplines/fields of study. The potential of intersectionality, however, has not been fully realized in policy, largely due to the challenges of operationalization. Recently some scholars and activists began to advance conceptual clarity and guidance for intersectionality policy applications; yet a pressing need remains for knowledge development and exchange in relation to empirical work that demonstrates how intersectionality improves public policy. This handbook fills this void by highlighting the key challenges, possibilities and critiques of intersectionality-informed approaches in public policy. It brings together international scholars across a variety of policy sectors and disciplines to consider the state of intersectionality in policy research and analysis. Importantly, it offers a global perspective on the added value and “how-to” of intersectionality-informed policy approaches that aim to advance equity and social justice.",9783319984735,
1070,Intersectionality and Higher Education,Identity and Inequality on College Campuses,W. Carson Byrd,"Though colleges and universities are arguably paying more attention to diversity and inclusion than ever before, to what extent do their efforts result in more socially just campuses? Intersectionality and Higher Education examines how race, ethnicity, class, gender, sexuality, sexual orientation, age, disability, nationality, and other identities connect to produce intersected campus experiences. Contributors look at both the individual and institutional perspectives on issues like campus climate, race, class, and gender disparities, LGBTQ student experiences, undergraduate versus graduate students, faculty and staff from varying socioeconomic backgrounds, students with disabilities, undocumented students, and the intersections of two or more of these topics. Taken together, this volume presents an evidence-backed vision of how the twenty-first century higher education landscape should evolve in order to meaningfully support all participants, reduce marginalization, and reach for equity and equality.",9780813597683,Intersectionality and Higher Education Identity and Inequality on College Campuses
1072,Intersectionality and Social Change,,Lynne M. Woehrle,"Volume 37 asks, what can the emerging discipline of intersectionality studies contribute to our quest to understand and analyze social movements, conflict and change? Through the intersectional lens questions often ignored and populations traditionally marginalized become the heart of the analysis.",9781784411053,
1074,"Intersectionality and ""Race"" in Education",,Kalwant Bhopal,"Education is a controversial subject in which difficult and contested discourses are the norm. Individuals in education experience multiple inequalities and have diverse identifications that cannot necessarily be captured by one theoretical perspective alone. This edited collection draws on empirical and theoretical research to examine the intersections of ""race,"" gender and class, alongside other aspects of personhood, within education. Contributors from the fields of education and sociology seek to locate the dimensions of difference and identity within recent theoretical discourses such as Critical Race Theory, Judith Butler and ‘queer’ theory, post-structural approaches and multicultural models, as they analyze whiteness and the education experience of minority ethnic groups. By combining a mix of intellectually rigorous, accessible, and controversial chapters, this book presents a distinctive and engaging voice, one that seeks to broaden the understanding of education research beyond the confines of the education sphere into an arena of sociological and cultural discourse.",9781136628993,
1076,Intersectionality and Urban Education,"Identities, Policies, Spaces & Power",Carl A. Grant,"In urban education, “urban” is a floating signifier that is imbued with meaning, positive or negative by its users. “Urban” can be used to refer to both the geographical context of a city and a sense of “less than,” most often in relation to race and/or socioeconomic status (Watson, 2011). For Noblit and Pink (2007), “Urban, rather, is a generalization as much about geography as it is about the idea that urban centers have problems: problems of too many people, too much poverty, too much crime and violence, and ultimately, too little hope” (p. xv). Recently, urban education scholars such as Anyon (2005), Pink and Noblit (2007), Blanchett, Klinger and Harry (2009), and Lipman (2013) have elucidated the social construction of oppression and privilege for urban students, teachers, schools, families, and communities using intersectionality theories. Building on their work, we see the need for an edited collection that would look across the different realms of urban education—theorizing identity markers in urban education, education in urban schools and communities, thinking intersectionally in teacher education & higher education, educational policies & urban spaces—seeking to better understand each topic using an intersectional lens. Such a collection might serve to conceptually frame or provide methodological tools, or act as a reference point for scholars and educators who are trying to address urban educational issues in light of identities and power. Secondly, we argue that education questions and/or problems beg to be conceptualized and analyzed through more than one identity axis. Policies and practices that do not take into account urban students’ intertwining identity markers risk reproducing patterns of privilege and oppression, perpetuating stereotypes, and failing at the task we care most deeply about: supporting all students’ learning across a holistic range of academic, personal, and justiceoriented outcomes. Can educational policies and practices address the social justice issues faced in urban schools and communities today? We argue that doing intersectional research and implementing educational policies and practices guided by these frameworks can help improve the “fit.” Particular attention needs to be paid to intersectionality as a lens for educational theory, policy, and practice. As urban educators we would be wise to consider the intertwining of these identity axes in order to better analyze educational issues and engage in teaching, learning, research, and policymaking that are bettertuned to the needs of diverse students, families, and communities.",9781623967345,"Intersectionality and Urban Education Identities, Policies, Spaces & Power"
1078,"Pursuing Intersectionality, Unsettling Dominant Imaginaries",,Vivian M. May,"Pursuing Intersectionality, Unsettling Dominant Imaginaries offers a sustained, interdisciplinary exploration of intersectional ideas, histories, and practices that no other text does. Deftly synthesizing much of the existing literatures on intersectionality, one of the most significant theoretical and political precepts of our time, May invites us to confront a disconcerting problem: though intersectionality is widely known, acclaimed, and applied, it is often construed in ways that depoliticize, undercut, or even violate its most basic premises. May cogently demonstrates how intersectionality has been repeatedly resisted, misunderstood, and misapplied: provocatively, she shows the degree to which intersectionality is often undone or undermined by supporters and critics alike. A clarion call to engage intersectionality’s radical ideas, histories, and justice orientations more meaningfully, Pursuing Intersectionality answers the basic questions surrounding intersectionality, attends to its historical roots in Black feminist theory and politics, and offers insights and strategies from across the disciplines for bracketing dominant logics and for orienting toward intersectional dispositions and practices.",9781136497551,
1080,Institutionalizing Intersectionality,The Changing Nature of European Equality Regimes,Andrea Krizsan,"An exploration of the ways that multiple inequalities are being addressed in Europe. Using country-based and region-specific case studies it provides an innovative comparative analysis of the multidimensional equality regimes that are emerging in Europe, and reveals the potential that these have for institutionalizing intersectionality.",9780230292956,Institutionalizing Intersectionality The Changing Nature of European Equality Regimes
1082,Using Mixed Methods to Study Intersectionality in Higher Education,"New Directions in Institutional Research, Number 151",Kimberly A. Griffin,"This volume offers institutional researchers several examples of the ways in which quantitative and qualitative methods can be integrated for a better grasp of how members of our educational communities understand and experience their environments on the basis of their multiple identities. The first two chapters provide context for the volume's theme with definitions and overview of the underpinnings of mixted methodology. Subsequent chapters illustrate the multiple ways in which qualitative and quantitative methods can be integrated to understand the complexity of identity and experiences of marginalized groups in the academy. Other chapters focus on students' experiences and demonstrate how mixed-methodology approaches were used to OL {list-style:disc}P:{margin-left 60px} explore college access among first-generation Asian Americans and Pacific Islanders analyze racial ideology of white males with interview data driving analysis of longitudinal dataset and research and accessment generating accurate understanding how of race and gender shape students' experiences within the campus The final chapter presents findings of a mixed-methods inquiry to challenge current conceptions about racial categorization and practices for gathering institutional data on students' identity. Volume editors Kimberly A Griffin, assistant professor of education policy studies at the Pennsylvania State University, and Samuel D. Museus, assistant professor of educational administration at University of Hawai?i Manoa, and contributing authors advocate for intersectionality research and argue that it holds great promise for advancing knowledge in higher education. Their book is ideal for institutions and institutional researchers who want to understand and most effectively serve their students and faculty. This is the 151st volume of the Jossey-Bass quarterly report series New Directions for Institutional Research. Always timely and comprehensive, New Directions for Institutional Research provides planners and administrators in all types of academic institutions with guidelines in such areas as resource coordination, information analysis, program evaluation, and institutional management.",9781118173473,"Using Mixed Methods to Study Intersectionality in Higher Education New Directions in Institutional Research, Number 151"
1085,Gender Norms and Intersectionality,"Connecting Race, Class and Gender",Riki Wilchins,"This book provides a starting point for a long overdue movement to elevate ""applied gender studies"", providing both a reference and guide for researchers, students, policymakers, funders, non-profit leaders, and grassroots advocates.",1786610833,"Gender Norms and Intersectionality Connecting Race, Class and Gender"
1087,"Analyzing Gender, Intersectionality, and Multiple Inequalities",Global-transnational and Local Contexts,Esther Ngan-Ling Chow,"Includes papers presented at the conference ""Gender and Social Transformation: Global, Transnational, and Local Realities and Perspectives"", Beijing, China in 2009. This title addresses topics such as: divisions of labor, migration, war and peace-building.",9780857247438,"Analyzing Gender, Intersectionality, and Multiple Inequalities Global-transnational and Local Contexts"
1089,Framing Intersectionality,Debates on a Multi-Faceted Concept in Gender Studies,Maria Teresa Herrera Vivar,"Originally conceived by Kimberlé Crenshaw in 1989 as a tool for the analysis of the ways in which different forms of social inequality, oppression and discrimination interact and overlap in multidimensional ways, the concept of 'intersectionality' has attracted much attention in international feminist debates over the last decade. Framing Intersectionality brings together proponents and critics of the concept, to discuss the 'state of the art' with those that have been influential in the debates that surround it. Engaging with the historical roots of intersectionality in the US-based 'race-class-gender' debate, this book also considers the European adoption of this concept in different national contexts, to explore issues such as migration, identity, media coverage of sexual violence against men and transnational livelihoods of high and low skilled migrants. Thematically arranged around the themes of the transatlantic migration of intersectionality, the development of intersectionality as a theory, men's studies and masculinities, and the body and embodiment, this book draws on empirical case studies as well as theoretical deliberations to investigate the capacity and the sustainability of the concept and shed light on the current state of intersectionality research. Presenting the latest work from a team of leading feminist scholars from the US and Europe, Framing Intersectionality will be of interest to all those with interests in gender, women's studies, masculinity, inequalities and feminist thought.",9781317133575,Framing Intersectionality Debates on a Multi-Faceted Concept in Gender Studies
1091,"Digital Entrepreneurship, Gender and Intersectionality",An East Asian Perspective,Wing-Fai Leung,"This book details qualitative research focusing on Internet startups, digital entrepreneurship, race and sex discrimination, and the sharing economy. Addressing the intersections between issues of gender, age, ethnicity and class, the author interviews startup founders, including many husband and wife teams, in order to understand the working and private lives of digital entrepreneurs in and from Taiwan who utilise Internet and mobile technologies, against a backdrop of the country’s political, social and economic history. It investigates contemporary debates about entrepreneurship as they are experienced by new generations of start-uppers who challenge existing social and cultural norms by becoming creative workers and embracing the precarity that exists in the volatile digital economy.",9783319975238,"Digital Entrepreneurship, Gender and Intersectionality An East Asian Perspective"
1093,Introducing Intersectionality,,Mary Romero,"How can we hope to understand social inequality without considering race, class, and gender in tandem? How do they interact with other categories such as sexuality, citizenship, and ableism? How does an inclusive analysis of domination and privilege move us closer to solutions touching the lives of diverse populations? In this clearly written book, Mary Romero presents intersectionality as a core facet of the sociological imagination. One-dimensional approaches are no longer acceptable. Instead, we must examine all systems of oppression simultaneously and how they integrate and work with or against each other to shape life experiences. Recognizing the dynamics of patriarchy, capitalism, and white supremacy, Romero shows how social inequality is maintained or minimized in various social settings and everyday sites of interaction. Drawing the theoretical threads together, the book demonstrates intersectional approaches in action in relation to the care crisis and wealth divide, to highlight the different understandings of these issues and their solutions arising from a comprehensive, intersectional examination. Offering an overview of scholarly and activist tradition in the development of intersectionality and how to apply intersectionality as a lens to enrich our understandings of social life, this introductory text will be an invaluable and welcome resource for all students of sociology.",9781509525294,
1095,The Intersectionality of Women's Lives and Resistance,,Dawn L. Hutchinson,"This book uses the tools of the arts, humanities, social sciences, and other fields to address challenges faced by women and girls around the world, both historically and in modern day, with an emphasis on intersectionality.",9781793613714,
