,items__volumeInfo__title,items__volumeInfo__subtitle,items__volumeInfo__authors__001,items__volumeInfo__description,items__volumeInfo__industryIdentifiers__identifier,title
355,Sex and Gender in Joseph Marx's 'Italienisches Liederbuch',Analysis and Performance,Sarah Levering,"When Joseph Marx (1882−1964) composed his collection of seventeen lieder under the title of Italienisches Liederbuch in 1912, he took the unusual step of notating explicitly in the score specific songs for male and female voices. In gendering his composition, Marx was likely following the model of Hugo Wolf’s identically titled Italienisches Liederbuch (1892/1896),which is (and was) customarily performed by two voices, male and female. This, however, was a performance convention that Wolf left unspecified in his score. Such specificity was unusual, as in the mature lieder tradition of the nineteenth century, while gender was often implied by the poetry—consider the male perspective in Schubert’s Die schöne Müllerin (1824) or the female perspective in Schumann’s Frauenliebe und -leben (1840)—it was rarely explicitly indicated int he score and songs were occasionally, if not frequently, performed by singers of either sex. To understand how Marx’s gendering decisions manifest themselves throughout the music and performance of the Liederbuch, this document will explore the gendered texts of Paul Heyse(1830−1914) and the gendered compositional elements in Marx’s score. Furthermore, this document will examine options available to singers who wish to modernize the performance ofthis work through the use of cross-singing and gender-neutral pronouns.",OCLC:1152522988,Sex and Gender in Joseph Marx's 'Italienisches Liederbuch' Analysis and Performance
356,Sex vs Gender,Plus a practical guide. 'How to create a gender neutral environment'.,Nate Altera,"A complicated topic made short, simple and clear. This book will be of interest to everyone. It will help you to understand the difference between a person’s biological sex, gender identity and sexual orientation. Interesting life stories will allow you to experience what it is like to be “different”. You will be able to personally participate in the gender and sexual orientation choices made by every non-binary, trans or non-heterosexual person. Bringing together scientific facts from the fields of biology and history, statistical data from different countries, and the latest news on this topic, will make it possible to understand what the “gender identity” of a person is. You will discover how its variations were, and are, treated throughout the world. A supplementary guide, 'How to create a gender neutral environment', will support organisations and individuals to implement or/and improve a gender equality policy. These practical recommendations will help reduce levels of stress and discrimination for trans and non-binary people and create a work environment in which all customers, visitors, colleagues and employees will feel comfortable and welcome. This book does not contain medical advice. Please consult a trained medical professional for any matter relating to your health.",,Sex vs Gender Plus a practical guide. 'How to create a gender neutral environment'.
357,Notebook,Gender Neutral Pronounsheyhem Genderfluid with Rainbow Lined Ruled Paper Notebook Journal Size 6inx9in Writing Diary Or Take Notes,Jonh Mark,Lined Ruled Paper Notebook Journal Size 6inx9in Writing Diary or Take Notes Thistylish and elegant notebook and writing journal Perfect gift forchool Notebook - Notebook For Arts - Notebook For Girls - Notebook For Boys - choolupplies - Back tochoolupplies - Journal - Writing - Organizing - Lists - Journaling - Drawing - Note Taking - Budget Tracking - Habit Tracking - Plan Your Day and Brainstorming,9798615594403,Notebook Gender Neutral Pronounsheyhem Genderfluid with Rainbow Lined Ruled Paper Notebook Journal Size 6inx9in Writing Diary Or Take Notes
359,"Gender-Neutral Language Reform. Necessary Process, or Mere Demand of Hypersensitive Feminists?",,Juliane Amthor,"Essay from the year 2012 in the subject Women Studies / Gender Studies, grade: 1,3, Free University of Berlin (Institut für englische Philologie), course: Linguistic Theory and the Grammar of English, language: English, abstract: What has been ridiculed by male columnists as feminists’ “pronoun envy”, and exaggeratedly depicted as their wish to change words like ‘manhole cover’ to ‘personhole cover”, and ‘manipulate’ to ‘personipulate’, in fact, is too important and well-grounded a demand to be ridiculed. Emerging in the 1960s / 70s, the issue of sexist language by many is still seen as a persistent problem today. The continuity of this claim shows that feminists in favour of gender-neutral language use are by no means concerned with trivialities, but with core concepts of language. (Cf. Penfield 1987:6) This essay is based on the positive statement of the above quotation that meanings are not fixed, but language responds to new demands posed on it by its speakers. Its aim is to prove that, especially in English with its natural gender system, strong sexist tendencies exist, and therefore language reform is possible and necessary to contribute to the formal and actual equality of women.",9783668062566,
361,Language and Gender,,Felicity Titjen,"Essential study guides for the future linguist. Language and Gender is an introduction to the English language as a vital, dynamic force in understanding gender. It is suitable for students at advanced level and beyond. Written with input from the Cambridge English Corpus, it looks at the way English has adapted - through words, meanings and grammar - to represent different views and beliefs about gender. Using short activities to help explain analysis methods, this book guides students through major modern issues and concepts. It summarises key concerns and modern findings, while providing inspiration for language investigations and non-examined assessments (NEAs) with research suggestions.",9781108402170,
363,Gender Across Languages,Volume 4,Marlis Hellinger,"This is the fourth volume of a comprehensive reference work which provides systematic descriptions of the manifestations of gender in languages of diverse areal, typological and socio-cultural affiliations. To the 30 languages already analysed in previous volumes, Vol. 4 adds another 12 languages whose gendered structures have received little or no academic attention in the past. Again, the collection includes a broad spectrum of languages: It contains languages with and without grammatical gender, a language with noun classification and a classifier language; larger national languages as well as smaller languages with minority status; and, of course, members of diverse language families, i.e. Indo-European as well as Finno-Ugrian, Iroquois, Tai-Kadai and Niger-Congo. The volume illustrates the tremendous variation found in the area of gender representation across languages. At the same time, it will provide the much-needed material required for an explicitly comparative approach to linguistic manifestations of gender.",9789027268860,Gender Across Languages Volume 4
365,Gender-neutralizing the Hawaii Revised Statutes,,Mark Rosen,Responds to Senate concurrent resolution no. 199 (1991).,STANFORD:36105062175463,
366,Teaching Gender and Sexuality at School,Letters to Teachers,Tara Goldstein,"In a set of compelling letters to teachers, Tara Goldstein addresses a full range of issues facing lesbian, gay, bisexual, transgender, and queer (LGBTQ) students and families at elementary and secondary school. Goldstein talks to teachers about how they can support LGBTQ students and families by normalizing LGBTQ lives in the curriculum, challenging homophobic and transphobic ideas, and building an inclusive school culture that both expects and welcomes LGBTQ students and their families. Moving and energizing, Teaching Gender and Sexuality at School provides readers with the knowledge and resources they need to create safer and more positive classrooms and discusses what it takes to build authentic, trusting relationships with LGBTQ students and families.Includes ""The Unicorn Glossary"" by benjamin lee hicks, the performed ethnography Snakes and Ladders by Tara Goldstein, and the verbatim play Out at School by Tara Goldstein, Jenny Salisbury, and Pam Baer.",9780429760921,Teaching Gender and Sexuality at School Letters to Teachers
368,Can I Tell You about Gender Diversity?,"A Guide for Friends, Family and Professionals",C. J. Atkinson,Introducing Kit -- Gender identity -- Sexual orientation -- Transitioning -- Gender expression -- Gender dysphoria & euphoria -- Gender identity clinics -- Language -- The Equality Act -- School -- Misgendering -- Being Kit,1785921053,"Can I Tell You about Gender Diversity? A Guide for Friends, Family and Professionals"
370,Sissy,A Coming-of-Gender Story,Jacob Tobia,"A heart-wrenching, eye-opening, and giggle-inducing memoir about what it's like to grow up not sure if you're (a) a boy, (b) a girl, (c) something in between, or (d) all of the above. ""When the political reality facing this country seems dark, we need shinier, sparklier thinkers in the public eye. With a signature style matched only by their wit, Jacob fits that bill perfectly."" --Alan Cumming From the moment a doctor in Raleigh, North Carolina, put ""male"" on Jacob Tobia's birth certificate, everything went wrong. Alongside ""male"" came many other, far less neutral words: words that carried expectations about who Jacob was and who Jacob should be, words like ""masculine"" and ""aggressive"" and ""cargo shorts"" and ""SPORTS!"" Naturally sensitive, playful, creative, and glitter-obsessed, as a child Jacob was given the label ""sissy."" In the two decades that followed, ""sissy"" joined forces with ""gay,"" ""trans,"" ""nonbinary,"" and ""too-queer-to-function"" to become a source of pride and, today, a rallying cry for a much-needed gender revolution. Through revisiting their childhood and calling out the stereotypes that each of us have faced, Jacob invites us to rethink what we know about gender and offers a bold blueprint for a healed world--one free from gender-based trauma and bursting with trans-inclusive feminism. From Jacob's Methodist childhood and the hallowed halls of Duke University to the portrait-laden parlors of the White House, Sissy takes you on a gender odyssey you won't soon forget. Writing with the fierce honesty, wildly irreverent humor, and wrenching vulnerability that have made them a media sensation, Jacob shatters the long-held notion that people are easily sortable into ""men"" and ""women."" Sissy guarantees that you'll never think about gender--both other people's people's and your own--the same way again.",9780735218826,Sissy A Coming-of-Gender Story
373,Cancel Culture,The Latest Attack on Free Speech and Due Process,Alan Dershowitz,"In Cancel Culture, Alan Dershowitz—New York Times bestselling author and one of America’s most respected legal scholars—makes an argument for free speech, due process, and restraint against the often overeager impulse to completely cancel individuals and institutions at the ever-changing whims of social media-driven crowds. Alan Dershowitz has been called “one of the most prominent and consistent defenders of civil liberties in America” by Politico and “the nation’s most peripatetic civil liberties lawyer and one of its most distinguished defenders of individual rights” by Newsweek. Yet he has come under intense criticism for his steadfast and consistent championing of those same principles, and his famed “shoe‑on‑the‑other‑foot test,” to those who have been “cancelled” for any number of faults, both real and imagined. Cancel Culture is a defense of due process, free speech, and even-handedness in the application of judgment. It makes the case for restraint and care in decisions about whom and what to cancel, boycott, deplatform, and bar from public life, and offers recommendations for when, why, and to what degree these steps may be appropriate, as long as objective, fair-minded criteria can be determined and met. While Dershowitz argues against the worst excesses of cancel culture—the rush to judgment and the devastating results it can have on those who may be innocent, the power of social media to effect punishment without a thorough examination of evidence, the idea that historical events can be viewed through the same lens as actions in the present day—he also acknowledges that its defenders ostensibly try to use it to create meaningful, positive change, and notes that cancelling may itself be a constitutionally protected form of free speech. In the end, Cancel Culture represents an icon in the defense of free speech and due process reckoning with the greatest challenge and threat to these rights since the rise of McCarthyism. It is essential reading for anyone interested in or concerned about cancel culture, its effects on our society, and its significance in a greater historical and political context.",9781510764910,Cancel Culture The Latest Attack on Free Speech and Due Process
375,Takedown,Art in the Age of Cancel Culture,Farah Nayeri,"Farah Nayeri addresses the difficult questions plaguing the art world, from the bad habits of Old Masters, to the current grappling with identity politics. For centuries, art censorship has been a top-down phenomenon--kings, popes, and one-party states decided what was considered obscene, blasphemous, or politically deviant in art. Today, censorship can also happen from the bottom-up, thanks to calls to action from organizers and social media ratios. Artists and artworks are routinely taken to task for their insensitivity. In this new world order, artists, critics, philanthropists, galleries and museums alike are recalibrating their efforts to increase the visibility of marginalized voices and respond to the people's demands for better ethics in art. But what should we, the people, do with this newfound power? With exclusive interviews with Nan Goldin, Dana Schutz, Sam Durant, Faith Ringgold, and others, Nayeri tackles wide-ranging issues including sex, religion, gender, ethics, animal rights, and race. By asking and answering questions such as: Who gets to make art and who owns it? How do we correct the inequities of the past? What does authenticity, exploitation, and appropriation mean in art?, Takedown provides the necessary tools to navigate the art world.",1662600550,Takedown Art in the Age of Cancel Culture
377,With(Stan)ding Cancel Culture,Stan Twitter and Reactionary Fandoms,Hailey Roos,"Cancel culture is often regarded as a witch hunt on social media, a way to harass people into silence, an excuse to bully critics - but that was not always the case. This analysis traces the history of cancel culture, its appropriation by stans, and its rebirth as the commonly known petty, polarized behavior on Twitter. Cancel culture began on Black Twitter via callouts directed at public officials or celebrities for being racist, homophobic, sexist, etc. in an attempt to shed light on the abuse of power, to boycott corrupt companies, or to revoke support for problematic authority or celebrity figures. The social justice logic and activism behind cancel culture has been appropriated by Stan Twitter which is an obsessive, overzealous group of pop culture fans. Stans noticed the power that cancel culture had to end careers, twisted the activism into harassment, and restructured cancel culture as an excuse to censor anyone who questions, competes with, or critiques their idols. Today, cancel culture is viewed negatively because of the deeply negative effect of Stan Twitter had on this originally well-intentioned movement. This current version of cancel culture is almost always seen as an obstacle in the way of real progress in social justice activism. These two phenomena - cancel culture and stan Twitter - are the seeds of polarized behavior that have been planted in social media and that implicitly affect the ways that Twitter users respond to and make sense of the world in general.",OCLC:1242938373,With(Stan)ding Cancel Culture Stan Twitter and Reactionary Fandoms
378,Cancel Culture,"How to Thrive in a Society that Has Given Up on Masculinity, Femininity, Sex, Success, Gods, and a Great Life.",Alexander Reich,"You are living in a CANCEL CULTURE Do you feel that you could be much more? Do you feel that you know how to be a man, but society tells you otherwise? Do you feel that the things society teaches you about women just don't work right? Be the nice guy, but they still go for jerks? Do you wonder why people become successful, although everyone tells you it is impossible? Do you feel that this society lost its morality? Do you feel that how people behave in certain situations is just wrong? Congratulations. You found your inner self. Or you know at least that it is there, and something is wrong. And you would be right ✔ This society has canceled a lot of things which made us humans great, and made it possible to live together in peace and decency. Sadly, this isn't the case anymore. In CANCEL CULTURE(TM) I iterate over these things. Everything that is wrong in this society and how you can still be right with yourself and live a prosper life. Things that have been canceled: Masculinity Femininity Meaningful sex Morals Decency Gods Ancient wisdom Conversation Creativity Honor Meaning And much, much more I go over all these topics and show you what's wrong in this society, why, and how to make the best of it. This book will help you see a ton of lies we live every day. And then it helps you to make the proper adjustments to live in peace with the other gender, yourself, success, and the world.",9798646047657,"Cancel Culture How to Thrive in a Society that Has Given Up on Masculinity, Femininity, Sex, Success, Gods, and a Great Life."
379,I Do Not Consent,My Fight Against Medical Cancel Culture,"Simone Gold, M.D., J.D.","“The bumper-sticker directive to ‘follow the science’ was actually an evasion of responsibility. It let people off the hook for their bad decisions in a crisis. Was New York Governor Cuomo’s executive order sending COVID-hospitalized patients back to nursing homes to infect other vulnerable nursing home patients ‘following the science’? Of course not. And sending post-hospitalization COVID-positive patients back to nursing homes was unnecessary. Relative to the total nursing home population, Governor Cuomo contributed to a larger percentage of nursing-home deaths—especially when compared to the states without such a policy. New Jersey’s over seven thousand nursing home deaths account for half of the state’s fatalities since March. Pennsylvania did just as miserably. These governors made specific decisions that cost thousands of the most vulnerable, most expendable, their lives. But they didn’t do it to their own relatives.” —From I Do Not Consent",9781642938913,I Do Not Consent My Fight Against Medical Cancel Culture
381,Unassailable,"Protect Yourself from Deplatform Attacks, Cancel Culture & Other Online Disasters",Mark E Jeftovic,"We live in an age of cancel-culture run rampant, where those who don't agree with your opinions eschew civilized debate and instead opt to mobilize flash-mobs seeking to deplatform you, your content or your business. When even the president of the United States isn't immune from deplatform attacks, it tells us that somebody needed to write a book like ""Unassailable"". In his second book, internet industry veteran and naming expert Mark E. Jeftovic describes an overarching strategy that minimizes your attack surface against online censorship and helps you come back stronger and louder from takedowns. The first part of the book examines the history, philosophy and the ethos behind culture wars, free speech and battles for narrative control. Then in part 2 the reader is stepped through every component of their online infrastructure, from web hosting, to email delivery, to video hosting, to payment gateways in order to make sure you have as much control over your own online destiny as is technologically possible.All content creators need to read this book. Even if you think nothing you say is controversial or would run afoul of allowable opinion, the internet mob can turn on you in an instant. Be ready.",1999285212,"Unassailable Protect Yourself from Deplatform Attacks, Cancel Culture & Other Online Disasters"
383,Cancel Culture,,Lita Sorensen,"""Anthology of diverse perspectives regarding the social phenomenon of cancel culture, public shaming, and mob mentality. Volume introduction, guided reading questions, introductory material, critical thinking questions, resource material and index""--",1534507590,
385,Cancel This Book,The Progressive Case Against Cancel Culture,Dan Kovalik,"Examining a phenomenon that is sweeping the country, Cancel This Book shines the spotlight on the suppression of open and candid debate. The public shaming of individuals for actual or perceived offenses, often against emerging notions of proper racial and gender norms and relations, has become commonplace. In a number of cases, the shaming is accompanied by calls for the offending individuals to lose their jobs, positions, or other status. Frequently, those targeted for “cancellation” simply do not know the latest, ever-changing norms (often related to language) that they are accused of transgressing—or they have honest questions about issues that have been deemed off-limits for debate and discussion. Cancel This Book offers a unique perspective from Dan Kovalik, a progressive author who supports the ongoing movements for racial and gender equality and justice, but who is concerned about the prevalence of “cancelling” people, and especially of people who are well-intentioned and who are themselves allied with these movements. While many progressives believe that “cancelling” others is a form of activism and holding others accountable, Cancel This Book argues that “cancellation” is oftentimes counter-productive and destructive of the very values which the “cancellers” claim to support. And indeed, we now see instances in the workplace where employers are using this spirt of “cancellation” to pit employees against each other, to exert more control over the workforce and to undermine worker and labor solidarity. Kovalik observes that many progressives are quietly opposed to this “Cancel Culture” and to many instances of “cancellation” they witness, but they are afraid to air these concerns publicly lest they themselves be “cancelled.” The result is the suppression of open debate about important issues involving racial and gender matters, and even issues related to how to best confront the current COVID-19 pandemic. While people speak in whispers about their true feelings about such issues, critical debate and discussion is avoided, resentments build, and the movement for justice and equality is ultimately disserved.",9781510764996,Cancel This Book The Progressive Case Against Cancel Culture
387,We Will Not Cancel Us,And Other Dreams of Transformative Justice,adrienne maree brown,"Cancel culture addresses real harm...and sometimes causes more. It’s time to think this through. “Cancel” or “call-out” culture is a source of much tension and debate in American society. The infamous “Harper’s Letter,” signed by public intellectuals of both the left and right, sought to settle the matter and only caused greater division. Originating as a way for marginalized and disempowered people to take down more powerful abusers, often with the help of social media, cancel culture is seen by some as having gone “too far.” Adrienne maree brown, a respected cultural voice and a professional mediator, reframes the discussion for us, in a way that points to possible ways beyond the impasse. Most critiques of cancel culture come from outside the milieus that produce it, sometimes from even from its targets. Brown explores the question from a Black, queer, and feminist viewpoint that gently asks, how well does this practice serve us? Does it prefigure the sort of world we want to live in? And, if it doesn’t, how do we seek accountability and redress for harm in a way that reflects our values?",9781849354233,We Will Not Cancel Us And Other Dreams of Transformative Justice
389,Cancel Culture and the Left's Long March,,Kevin Edited by Donnelly,"Cancel culture and political correctness are destroying free speech and Western civilisation's institutions and way of life - it's time to fight back and return to sanity. A topical and informative anthology exploring the origins and impact of cancel culture and political correctness on Western societies - including schools, universities, ......",1925927563,
