,items__volumeInfo__title,items__volumeInfo__subtitle,items__volumeInfo__authors__001,items__volumeInfo__description,items__volumeInfo__industryIdentifiers__identifier,title
1435,"Stamped: Racism, Antiracism, and You",A Remix of the National Book Award-winning Stamped from the Beginning,Jason Reynolds,"The #1 New York Times bestseller and a USAToday bestseller! A timely, crucial, and empowering exploration of racism--and antiracism--in America This is NOT a history book. This is a book about the here and now. A book to help us better understand why we are where we are. A book about race. The construct of race has always been used to gain and keep power, to create dynamics that separate and silence. This remarkable reimagining of Dr. Ibram X. Kendi's National Book Award-winning Stamped from the Beginning reveals the history of racist ideas in America, and inspires hope for an antiracist future. It takes you on a race journey from then to now, shows you why we feel how we feel, and why the poison of racism lingers. It also proves that while racist ideas have always been easy to fabricate and distribute, they can also be discredited. Through a gripping, fast-paced, and energizing narrative written by beloved award-winner Jason Reynolds, this book shines a light on the many insidious forms of racist ideas--and on ways readers can identify and stamp out racist thoughts in their daily lives. Download the free educator guide here: https://www.hachettebookgroup.com/wp-content/uploads/2020/03/Stamped-Educator-Guide.pdf",9780316453707,"Stamped: Racism, Antiracism, and You A Remix of the National Book Award-winning Stamped from the Beginning"
1437,Antiracism Inc.,Why the Way We Talk About Racial Justice Matters,Felice Blake,"Antiracism Inc. traces the ways people along the political spectrum appropriate, incorporate, and neutralize antiracist discourses to perpetuate injustice. It also examines the ways organizers continue to struggle for racial justice in the context of such appropriations. Antiracism Inc. reveals how antiracist claims can be used to propagate racism, and what we can do about it. While related to colorblind, multicultural, and diversity discourses, the appropriation of antiracist rhetoric as a strategy for advancing neoliberal and neoconservative agendas is a unique phenomenon that requires careful interrogation and analysis. Those who co-opt antiracist language and practice do not necessarily deny racial difference, biases, or inequalities. Instead, by performing themselves conservatively as non-racists or liberally as 'authentic' antiracists, they purport to be aligned with racial justice even while advancing the logics and practices of systemic racism. Antiracism Inc. therefore considers new ways of struggling toward racial justice in a world that constantly steals and misuses radical ideas and practices. The critical essays and poetry collected here focus on people and methods that do not seek inclusion in the hierarchical order of gendered racial capitalism. Rather, they focus on aggrieved peoples who have always had to negotiate state violence and cultural erasure, but who also work to build the worlds they envision. These collectivities seek to transform social structures and establish a new social warrant guided by what W.E.B. Du Bois called ""abolition democracy,"" a way of being and thinking that privileges people, mutual interdependence, and ecological harmony over individualist self-aggrandizement and profits. Further, these aggrieved collectivities reshape social relations away from the violence and alienation inherent to gendered racial capitalism, and towards the well-being of the commons. Antiracism Inc. articulates methodologies that strive toward freedom dreams without imposing monolithic or authoritative definitions of resistance. Because power seeks to neutralize revolutionary action through incorporation as much as through elimination, these freedom dreams, as well as the language used to articulate them, are constantly transformed through the critical and creative interventions stemming from the active engagement in liberation struggles. In addition to critical essays by Felice Blake (""How Does Black Cultural Criticism 'Work' in the Age of Antiracist Incorporation?""), Kevin Fellezs (""Nahenahe [Soft, Sweet, Melodious], the Sound of Kanaka Maoli [Native Hawaiian] Refusal""), Daniel Martinez HoSang (""A Wider Type of Freedom""), Paula Ioanide (""Defensive Appropriations""), George Lipsitz (""The Logic of 'Illogical' Opposition: Tools and Tactics for Tough Times""), Alison Reed (""Gentrifying Disciplines: The Institutional Management of Trauma and Creative Dissent""), Phia S. Salter + Glenn Adams (""Provisional Strategies for Decolonizing Consciousness""), and Barbara Tomlinson (""Wicked Problems and Intersectionality Telephone""), the volume also includes poetry by Dubian Ade, Jari Bradley, Dahlak Brathwaite, Corinne Contreras, Ebony P. Donnley, Colin Masashi Ehara, David Scott (YDS), Daniel Hershel Silber-Baker, and Sophia Terazawa, as well as interviews with Diana Zuñiga (CURB, Californians United for a Responsible Budget) and with Gaby Hernandez and Marissa Garcia (PODER, People Organizing for the Defense and Equal Rights of Santa Barbara Youth).",1950192237,Antiracism Inc. Why the Way We Talk About Racial Justice Matters
1439,Everyday Antiracism,Getting Real about Race in School,Mica Pollock,"In ""Everyday Antiracism,"" leading educators deal with the most challenging questions about race in school, offering invaluable and effective advice. Contributors including Beverly Daniel Tatum, Sonia Nieto, Pedro Noguera, and others.",UOM:39015077606211,Everyday Antiracism Getting Real about Race in School
1440,White Ally,A Guide to Cultivating a Deeply Spiritual AntiRacism Practice,Sonia Roberts,"The Yamas and Niyamas, yoga's ten guidelines, guide you to live in peace and harmony with yourself and the world. In this book, learn how to cultivate an anti-racism practice using the framework of yoga's ten guidelines, the Yamas and the Niyamas. Examine your biases, conditioning, values and beliefs by exploring the philosophy of each guideline in every chapter. Brief guided meditations are provided at the end of the chapter to enhance mindfulness and self-awareness. Reflection questions are included at the end of the chapter for deepened understanding and self inquiry. Following the philosophy of each guideline, interwoven with examples and personal stories, invites you to become more mindful of recognizing racism within yourself and the patterns and systems of oppression in the world. The Yamas and Niyamas guide you toward letting go of limiting and harmful behaviors and beliefs. These guidelines free you to see beyond your own desires into the collective good. As you become more mindful and begin to acknowledge systemic racism and injustice, you can use this awareness to become a more effective ally to people of color. Open your heart and mind, gain the awareness, skills and compassion to change the world from the inside out.",1070734047,White Ally A Guide to Cultivating a Deeply Spiritual AntiRacism Practice
1442,Antiracism Education In and Out of Schools,,Aminkeng A. Alemanji,"This book explores how antiracism theories can be translated into practice within formal education, as well as in other educational programs outside schools, as very often racism occurs outside the school environment. Combating racism both in and out of school therefore increases the chances of overcoming issues of racism. As racism continues to plague the world, efforts to combat it deserve more attention and diversification across all walks of life. In education, such efforts benefit from being modeled within the framework of antiracism education, rather than simpler multicultural and intercultural theorization and understanding which have proved popular. As such, this book critiques integration and multicultural programs, and instead highlights the advantages of grounding such programs within an antiracist framework. This book demonstrates why and how antiracism education is key to challenging issues of racial injustice at a time when multiculturalism and interculturalism have being proclaimed “dead”. It will be highly relevant to researchers and students working in the areas of Education and Sociology, particularly those with an interest in antiracism methodologies.",9783319563152,
1444,Antiracism,An Introduction,Alex Zamalin,"An introduction to antiracism, a powerful tradition crucial for energizing American democracy On August 12, 2017, in Charlottesville, Virginia, a rally of white nationalists and white supremacists culminated in the death of a woman murdered in the street. Those events made clear that racism is alive and well in the United States of America. However, they also brought into sharp relief another American tradition: antiracism. While racists marched and chanted in the streets, they were met and matched by even larger numbers of protesters calling for racism’s end. Racism is America’s original and most enduring sin, with well-known historic and contemporary markers: slavery, lynching, Jim Crow, redlining, mass incarceration, police brutality. But racism has always been challenged by an opposing political theory and practice. Alex Zamalin’s Antiracism tells the story of that opposition. The most theoretically generative and politically valuable source of antiracist thought has been the black American intellectual tradition. While other forms of racial oppression—for example, anti-Semitism, Islamophobia, and anti-Latino racism—have been and continue to be present in American life, antiblack racism has always been the primary focus of American antiracist movements. From antislavery abolition to the antilynching movement, black socialism to feminism, the long Civil Rights movement to the contemporary Movement for Black Lives, Antiracism examines the way the black antiracist tradition has thought about domination, exclusion, and power, as well as freedom, equality, justice, struggle, and political hope in dark times. Antiracism is an accessible introduction to the political theory of black American antiracism, through a study of the major figures, texts, and political movements across US history. Zamalin argues that antiracism is a powerful tradition that is crucial for energizing American democracy.",9781479822638,Antiracism An Introduction
1446,Activist Scholarship,"Antiracism, Feminism, and Social Change",Julia Sudbury,"Can scholars generate knowledge and pedagogies that bolster local and global forms of resistance to U.S. imperialism, racial/gender oppression, and the economic violence of capitalist globalization? This book explores what happens when scholars create active engagements between the academy and communities of resistance. In so doing, it suggests a new direction for antiracist and feminist scholarship, rejecting models of academic radicalism that remain unaccountable to grassroots social movements. The authors explore the community and the academy as interlinked sites of struggle. This book provides models and the opportunity for critical reflection for students and faculty as they struggle to align their commitments to social justice with their roles in the academy. At the same time, they explore the tensions and challenges of engaging in such contested work.",9781317264248,"Activist Scholarship Antiracism, Feminism, and Social Change"
1448,Antiracism in Cuba,The Unfinished Revolution,Devyn Spence Benson,"Analyzing the ideology and rhetoric around race in Cuba and south Florida during the early years of the Cuban revolution, Devyn Spence Benson argues that ideas, stereotypes, and discriminatory practices relating to racial difference persisted despite major efforts by the Cuban state to generate social equality. Drawing on Cuban and U.S. archival materials and face-to-face interviews, Benson examines 1960s government programs and campaigns against discrimination, showing how such programs frequently negated their efforts by reproducing racist images and idioms in revolutionary propaganda, cartoons, and school materials. Building on nineteenth-century discourses that imagined Cuba as a raceless space, revolutionary leaders embraced a narrow definition of blackness, often seeming to suggest that Afro-Cubans had to discard their blackness to join the revolution. This was and remains a false dichotomy for many Cubans of color, Benson demonstrates. While some Afro-Cubans agreed with the revolution's sentiments about racial transcendence--""not blacks, not whites, only Cubans--others found ways to use state rhetoric to demand additional reforms. Still others, finding a revolution that disavowed blackness unsettling and paternalistic, fought to insert black history and African culture into revolutionary nationalisms. Despite such efforts by Afro-Cubans and radical government-sponsored integration programs, racism has persisted throughout the revolution in subtle but lasting ways.",9781469626734,Antiracism in Cuba The Unfinished Revolution
1450,Crash Politics and Antiracism,Interrogations of Liberal Race Discourse,Philip S. S. Howard,"Crash Politics and Antiracism argues that race and racism continue to script the social fabric in Euro-North America. While dominant discourses claim that we have made significant progress away from racial bigotry, there is no shortage of evidence that inequitable ideologies of race prevail. Similarly, mainstream cinematic productions have mass appeal, yet tend to demonstrate and cement the racial ideologies that circulate in society. As such, they can be used either for the propagation of dominant ideologies or in the development of critical consciousness. Crash Politics and Antiracism does the latter, understanding the award-winning film Crash as an especially interesting pedagogical site, for while to many it offers a fresh analysis of race and racism, the antiracist analyses in this book suggest that it recycles oppressive understandings of race. The essays in this collection, written from a variety of racial locations, provide readings of Crash that seek to disrupt the movie's subtle messages and, more importantly, some of the intractable liberal notions of race that perpetuate racial inequity. The considerations raised in this volume will enrich critical conversations about how race and racism work in contemporary Euro-North American societies - whether these conversations occur in classrooms, boardrooms, or living rooms.",1433102463,Crash Politics and Antiracism Interrogations of Liberal Race Discourse
1452,Race and Antiracism in Black British and British Asian Literature,,Dave Gunning,"Race and Antiracism in Black British and British Asian Literature' offers the first extended exploration of the cultural impact of the politics of race and antiracism in Britain through focussing on a selection of recent novels by black British and British Asian writers. The study argues that an understanding of how race and ethnicity function in contemporary Britain can only be gained through attention to antiracism: the politics of opposing discrimination that manifest at the level of state legislation, within local and national activism, and inside the scholarly exploration of race. It is antiracism that now most strongly conditions the emergence of racial categorisations but also of racial identities and models of behaviour. This sense of how antiracism may determine the form and content of both political debate and individual identity is traced through an examination of ten novels by black British and British Asian writers. These authors range from the well known to the critically neglected: works by Monica Ali, Nadeem Aslam, Fred D'Aguiar, Ferdinand Dennis, Hanif Kureishi, Gautam Malkani, Caryl Phillips, Mike Phillips, Zadie Smith, and Meera Syal are carefully read to explore the impacts of antiracism. These literary studies are grouped into three main themes, each of which is central to the direction of racial political identities over the last two decades in Britain: the use of the continent of Africa as a symbolic focus for black political culture; the changing forms of Muslim culture in Britain; and the emergence of a multiculturalist ethos based around the notion of ethnic communities.",9781781388181,
1454,Discourses of Antiracism in France,,Catherine Lloyd,"First published in 1998, this book is an examination of antiracist discourses and practices in France. It sets out to trace the development of post-war French antiracism through the life of antiracist organizations, setting this within a broader historical, political and social context. It breaks new ground in that it analyses antiracism as a body of ideas in its own right, rather than as a mirror image of racism. The author uses previously unpublished archival material from French organizations combined with observations from current events. She argues that antiracist discourses and practices are structured around four main themes: discrimination, representation, solidarity and hegemony. While perceptions of discrimination have evolved into complex understandings of social exclusion, the representational functions of antiracist groups were challenged by immigrant workers movements themselves. Solidarity remained central to antiracist practices in different political contexts. Underpinning these features lies a hegemonic social project through which antiracists have sought to promote a 'common sense' through political and educational campaigns. The author concludes that French antiracism although constantly changing and refocusing is now a pluralist, transversal, hegemonic movement and an important component of civil society.",9780429829123,
1456,Transpacific Antiracism,"Afro-Asian Solidarity in 20th-Century Black America, Japan, and Okinawa",Yuichiro Onishi,"Transpacific Antiracism introduces the dynamic process out of which social movements in Black America, Japan, and Okinawa formed Afro-Asian solidarities against the practice of white supremacy in the twentieth century. Yuichiro Onishi argues that in the context of forging Afro-Asian solidarities, race emerged as a political category of struggle with a distinct moral quality and vitality. This book explores the work of Black intellectual-activists of the first half of the twentieth century, including Hubert Harrison and W. E. B. Du Bois, that took a pro-Japan stance to articulate the connection between local and global dimensions of antiracism. Turning to two places rarely seen as a part of the Black experience, Japan and Okinawa, the book also presents the accounts of a group of Japanese scholars shaping the Black studies movement in post-surrender Japan and multiracial coalition-building in U.S.-occupied Okinawa during the height of the Vietnam War which brought together local activists, peace activists, and antiracist and antiwar GIs. Together these cases of Afro-Asian solidarity make known political discourses and projects that reworked the concept of race to become a wellspring of aspiration for a new society.",9781479897322,"Transpacific Antiracism Afro-Asian Solidarity in 20th-Century Black America, Japan, and Okinawa"
1458,Racism and Antiracism,"Inequalities, Opportunities and Policies",Peter Braham,"This key text explores the nature and extent of racial discrimination, and the successes and failures of equal opportunities programmes. A successful balance of important recent articles and substantial contributions specially written for the volume, it presents analyses of institutional racism in immigration law, housing, social work, employment training and the criminal justice system. The contributors explore changes over time and examine the interwoven strands of `race', class and gender that form the pattern of disadvantage. They then discuss the formulation, implementation and outcomes of equal opportunities policies in the local state and the private sector, rigorously investigating both `liberal' and `radical' appro",UOM:39015025221535,"Racism and Antiracism Inequalities, Opportunities and Policies"
1459,Stamped (For Kids),"Racism, Antiracism, and You",Jason Reynolds,"This chapter book edition of the #1 New York Times bestseller by luminaries Ibram X. Kendi and Jason Reynolds is an essential introduction to the history of racism and antiracism in America RACE. Uh-oh. The R-word. But actually talking about race is one of the most important things to learn how to do. Adapted from the groundbreaking bestseller Stamped: Racism, Antiracism, and You, this book takes readers on a journey from present to past and back again. Kids will discover where racist ideas came from, identify how they impact America today, and meet those who have fought racism with antiracism. Along the way, they’ll learn how to identify and stamp out racist thoughts in their own lives. Ibram X. Kendi’s research, Jason Reynolds’s and Sonja Cherry-Paul’s writing, and Rachelle Baker’s art come together in this vital read, enhanced with a glossary, timeline, and more.",9780316167383,"Stamped (For Kids) Racism, Antiracism, and You"
1461,The Feminist Bookstore Movement,Lesbian Antiracism and Feminist Accountability,Kristen Hogan,"From the 1970s through the 1990s more than one hundred feminist bookstores built a transnational network that helped shape some of feminism's most complex conversations. Kristen Hogan traces the feminist bookstore movement's rise and eventual fall, restoring its radical work to public feminist memory. The bookwomen at the heart of this story—mostly lesbians and including women of color—measured their success not by profit, but by developing theories and practices of lesbian antiracism and feminist accountability. At bookstores like BookWoman in Austin, the Toronto Women’s Bookstore, and Old Wives’ Tales in San Francisco, and in the essential Feminist Bookstore News, bookwomen changed people’s lives and the world. In retelling their stories, Hogan not only shares the movement's tools with contemporary queer antiracist feminist activists and theorists, she gives us a vocabulary, strategy, and legacy for thinking through today's feminisms.",9780822374336,The Feminist Bookstore Movement Lesbian Antiracism and Feminist Accountability
1463,Feminism and Antiracism,International Struggles for Justice,Kathleen M. Blee,"From Madonna and drag queens to cyberpunk and webzines, popular culture constitutes a common and thereby critical part of our lives. Yet the study of popular culture has been condemned and praised, debated and ridiculed. In Popular Culture: An Introduction, Carla Freccero reveals why we study popular culture and how it is taught in the classroom. Blending music, science fiction, and film, Freccero shows us that an informed awareness of politics, race, and sexuality is essential to any understanding of popular culture. Freccero places rap music, the Alien Trilogy and Sandra Cisneros in the context of postcolonialism, identity politics, and technoculture to show students how they can draw on their already existing literacies and on the cultures they know in order to think critically. Complete with a glossary of useful terms, a sample syllabus and extensive bibliography, this book is the concise introduction to the study of popular culture.",9780814798546,Feminism and Antiracism International Struggles for Justice
1465,Racism And Antiracism In Real Schoolsa,"Theory, Policy, Practice","Gillborn , David","* How are 'race' and racism implicated in education policy and practice? * What does effective antiracism look like in practice? * How can teachers and school students be encouraged to think critically about their racialized assumptions and actions? In exploring these questions David Gillborn makes a vital contribution to the debate on 'race' and racism in education. He focuses on racism in the policy, research, theory and practice of education, and includes the first major study of antiracism at the level of whole-school management and classroom practice. The voices of teachers and school students bring the issues to life, and illustrate the daily problems of life in urban schools. This is a fascinating picture of the key matters facing managers, classroom teachers and their students as schools struggle to develop strong and workable approaches to anti-racist education. It is accompanied by a critical review of current debates and controversies concerning 'race', ethnicity and identity. Arguing for a critical return to the concept of 'race', Racism and Antiracism in Real Schools represents an important addition to the literature on the theory and practice of education in a racist society.",9780335190928,"Racism And Antiracism In Real Schoolsa Theory, Policy, Practice"
