,results__bestsellers_date,results__published_date,results__display_name,results__normal_list_ends_at,results__books__rank,results__books__primary_isbn10,results__books__primary_isbn13,results__books__description,results__books__title,results__books__author
6459,4/11/2020,4/26/2020,,,9.0,198214050X,9.78198E+12,The conservative commentator espouses free-market capitalism.,ARGUING WITH SOCIALISTS,Glenn Beck
6483,4/11/2020,4/26/2020,,,13.0,1250153298,9.78125E+12,The Grammy Award-winning musician retraces her path to discovering her own worth.,MORE MYSELF,Alicia Keys with Michelle Burford
6501,6/17/2017,7/2/2017,Combined Print & E-Book Nonfiction,15.0,1.0,1478923083,9.78148E+12,The former House speaker explains the president’s philosophy and political agenda.,UNDERSTANDING TRUMP,Newt Gingrich
6520,6/17/2017,7/2/2017,,,4.0,1501155563,9.7815E+12,The comedian’s personal and professional life.,I CAN'T MAKE THIS UP,Kevin Hart with Neil Strauss
6536,6/17/2017,7/2/2017,,,6.0,62362593,9.78006E+12,The fiction writer and essayist’s memoir about life as a “woman of size.”,HUNGER,Roxane Gay
6542,6/17/2017,7/2/2017,,,7.0,316154725,9.78032E+12,"Excerpts from the writer’s diaries, 1977-2002.",THEFT BY FINDING,David Sedaris
6549,6/17/2017,7/2/2017,,,8.0,1250109841,9.78125E+12,Stories of the Civil War; a companion to the Fox historical docudrama.,BILL O'REILLY'S LEGENDS AND LIES: THE CIVIL WAR,David Fisher
6555,6/17/2017,7/2/2017,,,9.0,802127002,9.7808E+12,An account of the Tet Offensive battle that was a turning point in the American war in Vietnam.,HUE 1968,Mark Bowden
6585,6/17/2017,7/2/2017,,,14.0,1608468909,9.78161E+12,"Klein describes Trump's ""corporate coup"" and offers suggestions for how to oppose him.",NO IS NOT ENOUGH,Naomi Klein
6591,6/17/2017,7/2/2017,,,15.0,031627075X,9.78032E+12,The Indian writer’s memoir of his complicated relationship with his mother.,YOU DON'T HAVE TO SAY YOU LOVE ME,Sherman Alexie
6603,8/22/2020,9/6/2020,,,2.0,1982149973,9.78198E+12,The Fox News host offers his assessment on what is at stake in the 2020 election.,LIVE FREE OR DIE,Sean Hannity
6621,8/22/2020,9/6/2020,,,5.0,1982141468,9.78198E+12,The clinical psychologist gives her assessment of events and patterns inside her family and how they shaped President Trump.,TOO MUCH AND NEVER ENOUGH,Mary L Trump
6639,8/22/2020,9/6/2020,,,8.0,593129040,9.78059E+12,The wife of the country music singer Thomas Rhett describes her mission work and life in the spotlight.,LIVE IN LOVE,Lauren Akins with Mark Dagostino
6651,8/22/2020,9/6/2020,,,10.0,1982157992,9.78198E+12,Who is the Canadian-American game show host whose pronunciation of the word “genre” has been shared widely on social media?,THE ANSWER IS ...,Alex Trebek
6657,8/22/2020,9/6/2020,,,11.0,63046105,9.78006E+12,The Duke and Duchess of Sussex’s journey from courtship to their decision to step away from their royal lives.,FINDING FREEDOM,Omid Scobie and Carolyn Durand
6669,8/22/2020,9/6/2020,,,13.0,679763880,9.78068E+12,"An account of the Great Migration of 1915-70, in which nearly six million African-Americans abandoned the South.",THE WARMTH OF OTHER SUNS,Isabel Wilkerson
6676,8/22/2020,9/6/2020,,,14.0,525658459,9.78053E+12,The former political campaign strategist evaluates the changes within the Republican Party in the last half-century.,IT WAS ALL A LIE,Stuart Stevens
6689,9/28/2019,10/13/2019,Combined Print & E-Book Nonfiction,15.0,1.0,62049534,9.78006E+12,"The Hollywood star chronicles the rocky relationships, body image issues and public perceptions that affected her attempts to balance family and fame.",INSIDE OUT,Demi Moore
6695,9/28/2019,10/13/2019,,,2.0,125023722X,9.78125E+12,The conservative commentator weaves interviews and personal history to portray the power and influence of the 45th president.,THE UNITED STATES OF TRUMP,Bill O'Reilly
6709,9/28/2019,10/13/2019,,,4.0,62906372,9.78006E+12,"How the hairstylist, comedian and ""Queer Eye"" star overcame ridicule and trauma.",OVER THE TOP,Jonathan Van Ness
6715,9/28/2019,10/13/2019,,,5.0,073522370X,9.78074E+12,A sexual assault victim reclaims her identity and challenges our culture and criminal justice system as they relate to this issue.,KNOW MY NAME,Chanel Miller
6733,9/28/2019,10/13/2019,,,8.0,812996836,9.78081E+12,The former Marine infantry officer and secretary of defense recounts key moments from his career and imparts his leadership philosophy.,CALL SIGN CHAOS,Jim Mattis and Bing West
6739,9/28/2019,10/13/2019,,,9.0,150118220X,9.7815E+12,"An oral history of the events that occurred on Sept. 11, 2001, based on transcripts, declassified documents and interviews.",THE ONLY PLANE IN THE SKY,Garrett M. Graff
6745,9/28/2019,10/13/2019,,,10.0,1642933414,9.78164E+12,The Fox News contributor and former Secret Service agent gives his take on the Mueller investigation.,EXONERATED,Dan Bongino
6763,9/28/2019,10/13/2019,,,13.0,525657681,9.78053E+12,"A memoir by the musician and artist surveys events during 2016, including a visit to see dying friends and a sea change in the political landscape.",YEAR OF THE MONKEY,Patti Smith
6769,9/28/2019,10/13/2019,,,14.0,1250244021,9.78125E+12,The written confidences and daily life of a Jewish teenager in Poland as the Nazis spread throughout Europe from 1939 to 1942.,RENIA'S DIARY,Renia Spiegel
6775,9/28/2019,10/13/2019,,,15.0,525560343,9.78053E+12,Two reporters for The New York Times recount their investigation into Harvey Weinstein’s alleged abuses of power and the subsequent global disclosure of women’s traumatic stories.,SHE SAID,Jodi Kantor and Megan Twohey
6836,12/28/2019,1/12/2020,,,9.0,014313356X,9.78014E+12,"Speeches by the Swedish climate activist, including her address to the United Nations.",NO ONE IS TOO SMALL TO MAKE A DIFFERENCE,Greta Thunberg
6884,10/7/2017,10/22/2017,,,2.0,399590560,9.7804E+12,"A series of essays that cover each year of the Obama administration, the writer's own journey and the echoes of American history in modern times.",WE WERE EIGHT YEARS IN POWER,Ta-Nehisi Coates
6896,10/7/2017,10/22/2017,,,4.0,1250179459,9.78125E+12,27 psychiatrists and mental health experts give their assessments of the president.,THE DANGEROUS CASE OF DONALD TRUMP,edited  Bandy X Lee
6909,10/7/2017,10/22/2017,,,6.0,735213658,9.78074E+12,"A study of Amazon, Apple, Facebook and Google, with suggestions on applying these companies' strategies to your own business or career.",THE FOUR,Scott Galloway
6921,10/7/2017,10/22/2017,,,8.0,110198001X,9.7811E+12,A biography of the monk whose writings sparked the Protestant Reformation.,MARTIN LUTHER,Eric Metaxas
6927,10/7/2017,10/22/2017,,,9.0,1250141923,9.78125E+12,The actor and comedian describes his various addictions and how he was able to move away from them.,RECOVERY,Russell Brand
6949,10/7/2017,10/22/2017,,,12.0,393249891,9.78039E+12,"An American undertaker chronicles the diversity of death practices around the globe, the better to argue for changes at home.",FROM HERE TO ETERNITY,Caitlin Doughty
6961,10/7/2017,10/22/2017,,,14.0,735290512,9.78074E+12,"The author, who moved to Uganda and adopted 13 children, has her faith tested after facing tragedy.",DARING TO HOPE,Katie Davis Majors
6979,8/7/2021,8/22/2021,,,2.0,63079429,9.78006E+12,The retired U.S. Army lieutenant colonel recounts his actions that led to the impeachment of President Trump and his testimony before Congress.,"HERE, RIGHT MATTERS",Alexander Vindman
6985,8/7/2021,8/22/2021,,,3.0,593298942,9.78059E+12,"The Pulitzer Prize-winning reporters examine Trump’s final year in office, with a focus on the key players around him.",I ALONE CAN FIX IT,Carol Leonnig and Philip Rucker
7003,8/7/2021,8/22/2021,,,6.0,63049082,9.78006E+12,The Fox News host recounts his career and prescribes ways to defend against what he considers left-wing radicalism.,HOW I SAVED THE WORLD,Jesse Watters
7009,8/7/2021,8/22/2021,,,7.0,63001829,9.78006E+12,"The conservative commentator describes what he perceives as threats to American business, education and politics.",THE AUTHORITARIAN MOMENT,Ben Shapiro
7027,8/7/2021,8/22/2021,,,10.0,031656169X,9.78032E+12,"An account of Mildred Harnack, an American who became a central figure in the German resistance to Hitler.",ALL THE FREQUENT TROUBLES OF OUR DAYS,Rebecca Donner
7063,8/15/2015,8/30/2015,Combined Print & E-Book Nonfiction,15.0,1.0,1451606303,9.78145E+12,"The talk-radio host urges young Americans to resist the statist masterminds who he says are burdening them with debt, inferior education and illegal immigration.",PLUNDER AND DECEIT,Mark R Levin
7089,8/15/2015,8/30/2015,,,5.0,1476785651,9.78148E+12,A memoir of rising to stardom in the web video world.,YOU'RE NEVER WEIRD ON THE INTERNET (ALMOST),Felicia Day
7095,8/15/2015,8/30/2015,,,6.0,1594206279,9.78159E+12,The comedian enlists a sociologist to help him understand today’s dating scene.,MODERN ROMANCE,Aziz Ansari with Eric Klinenberg
7128,8/15/2015,8/30/2015,,,11.0,62372106,9.78006E+12,"Life inside the Playboy Mansion, by a former bunny and girlfriend of Hugh Hefner.",DOWN THE RABBIT HOLE,Holly Madison
7166,8/15/2015,8/30/2015,,,16.0,385537611,9.78039E+12,"A Pulitzer Prize-winning journalist's biography of Adolf Tolkachev, who spied for the United States inside the Soviet Union.",THE BILLION DOLLAR SPY,David E Hoffman
7172,8/15/2015,8/30/2015,,,17.0,1941393268,9.78194E+12,The Olympic medalist in judo and Ultimate Fighting Championship women's bantamweight competitor tells her story.,MY FIGHT / YOUR FIGHT,Ronda Rousey with Maria Burns Ortiz
7178,8/15/2015,8/30/2015,,,18.0,307717836,9.78031E+12,"A journey to rediscover America by trekking the 2,100 miles of the Appalachian Trail. First published in 1998; a 2015 movie.",A WALK IN THE WOODS,Bill Bryson
7185,8/15/2015,8/30/2015,,,19.0,1594203474,9.78159E+12,This Pulitzer Prize-winning surfing chronicle and memoir by a New Yorker writer celebrates a lifelong obsession.,BARBARIAN DAYS,William Finnegan
7191,8/15/2015,8/30/2015,,,20.0,812997573,9.78081E+12,Thirty years’ worth of the filmmaker’s interviews with comedians.,SICK IN THE HEAD,Judd Apatow
7203,1/26/2013,2/10/2013,,,2.0,547928173,9.78055E+12,The manager’s Red Sox years.,FRANCONA,Terry Francona and Dan Shaughnessy
7221,1/26/2013,2/10/2013,,,5.0,307700666,9.78031E+12,The Pulitzer Prize-winning author examines the world of Scientology. ,GOING CLEAR,Lawrence Wright
7239,1/26/2013,2/10/2013,,,8.0,1400067669,9.7814E+12,The Pulitzer Prize-winning biographer celebrates Jefferson’s skills as a practical politician.,THOMAS JEFFERSON,Jon Meacham
7245,1/26/2013,2/10/2013,,,9.0,None,9.78001E+12,The story of a boy subjected to violence and sexual abuse who became mute for several years but eventually escaped his family; originally published in 2008.,CRY SILENT TEARS,Joe Peters
7251,1/26/2013,2/10/2013,,,10.0,1416549838,9.78142E+12,"The political genius of Abraham Lincoln, revealed in his relationship with his cabinet; originally published in 2005.",TEAM OF RIVALS,Doris Kearns Goodwin
7293,1/26/2013,2/10/2013,,,16.0,425252868,9.78043E+12,A German fighter pilot aids an American bomber during World War II.,A HIGHER CALL,Adam Makos with Larry Alexander
7305,1/26/2013,2/10/2013,,,18.0,1594487154,9.78159E+12,Insights from social science about how to move others. ,TO SELL IS HUMAN,Daniel H Pink
7327,5/2/2015,5/17/2015,Combined Print & E-Book Nonfiction,15.0,1.0,None,9.7807E+12,"Two of the women who were kidnapped by a Cleveland school bus driver and imprisoned, raped and abused by him until they escaped after 10 years tell their story.",HOPE,Amanda Berry and Gina DeJesus with Mary Jordan and Kevin Sullivan
7333,5/2/2015,5/17/2015,,,2.0,1455584908,9.78146E+12,The Fox News contributor and former press secretary under President George W. Bush reviews her life and career and shares lessons she has learned.,AND THE GOOD NEWS IS ...,Dana Perino
7339,5/2/2015,5/17/2015,,,3.0,081299325X,9.78081E+12,The Times columnist extols personal virtues like kindness and honesty in a materialistic age.,THE ROAD TO CHARACTER,David Brooks
7365,5/2/2015,5/17/2015,,,7.0,385538731,9.78039E+12,"The author of “Into the Wild” discusses cases of acquaintance rape in Missoula, Mont., home of the University of Montana.",MISSOULA,Jon Krakauer
7371,5/2/2015,5/17/2015,,,8.0,None,9.7816E+12,"The story of a woman kidnapped in Cleveland in 2002, then tortured, who escaped in 2013.",FINDING ME,Michelle Knight with Michelle Burford Weinstein
7393,5/2/2015,5/17/2015,,,11.0,385352549,9.78039E+12,"A memoir by the neurologist and writer, the author of “Awakenings” and many other books.",ON THE MOVE,Oliver Sacks
7431,5/2/2015,5/17/2015,,,16.0,984504176,9.78098E+12,"The writer’s autobiography, the source of her Little House on the Prairie books, completed in 1930 and never published, is annotated by a biographer.",PIONEER GIRL,Laura Ingalls Wilder
7443,5/2/2015,5/17/2015,,,18.0,307496295,9.78031E+12,John Lennon’s first wife discusses their relationship.,JOHN,Cynthia Lennon
7449,5/2/2015,5/17/2015,,,19.0,1455504211,9.78146E+12,The former Treasury secretary and onetime head of Goldman Sachs  discusses how American business and political leaders can work  with China.,DEALING WITH CHINA,Henry M Paulson Jr
7461,12/26/2020,1/10/2021,Combined Print & E-Book Nonfiction,15.0,1.0,1524763160,9.78152E+12,"In the first volume of his presidential memoirs, Barack Obama offers personal reflections on his formative years and pivotal moments through his first term.",A PROMISED LAND,Barack Obama
7491,12/26/2020,1/10/2021,,,6.0,1571313656,9.78157E+12,"In a collection of essays, the poet celebrates various aspects of the natural world and its inhabitants.",WORLD OF WONDERS,Aimee Nezhukumatathil
7497,12/26/2020,1/10/2021,,,7.0,593136683,9.78059E+12,The MSNBC host gives an account of the 1973 investigation of then Vice President Spiro T. Agnew and its impact on politics and the media.,BAG MAN,Rachel Maddow and Michael Yarvitz
7503,12/26/2020,1/10/2021,,,8.0,1982112697,9.78198E+12,The comedian shares material he collected in an accordion folder over the last 45 years.,IS THIS ANYTHING?,Jerry Seinfeld
7509,12/26/2020,1/10/2021,,,9.0,316429066,9.78032E+12,The story of the killing of the former member of the Beatles by Mark David Chapman in 1980 and interviews with some of Lennon’s friends and associates.,THE LAST DAYS OF JOHN LENNON,James Patterson with Casey Sherman and Dave Wedge
7515,12/26/2020,1/10/2021,,,10.0,735213631,9.78074E+12,A re-examination of a basic biological function and a look at the science behind ancient breathing practices.,BREATH,James Nestor
7521,12/26/2020,1/10/2021,,,11.0,1250114292,9.78125E+12,Photos and stories of people from over 40 countries collected by the creator of “Humans of New York.”,HUMANS,Brandon Stanton
7527,12/26/2020,1/10/2021,,,12.0,1501145258,9.7815E+12,A collection of articles and speeches by the Supreme Court justice.,MY OWN WORDS,Ruth Bader Ginsburg with Mary Hartnett and Wendy W. Williams
7539,12/26/2020,1/10/2021,,,14.0,1627797041,9.78163E+12,The ninth book in the conservative commentator’s Killing series focuses on conflicts with Native Americans.,KILLING CRAZY HORSE,Bill O'Reilly and Martin Dugard
7557,6/6/2015,6/21/2015,,,2.0,1476762724,9.78148E+12,"A memoir of life among the wealthy women of the Upper East Side, in the satirical guise of an anthropological study.",PRIMATES OF PARK AVENUE,Wednesday Martin
7563,6/6/2015,6/21/2015,,,3.0,1621572676,9.78162E+12,"The political commentator denounces immigrants, immigration and liberals.","ADIOS, AMERICA!",Ann Coulter
7626,6/6/2015,6/21/2015,,,12.0,316403555,9.78032E+12,"The country music star discusses his life’s journey, from selling encyclopedias to professional fame.",IT'S A LONG STORY,Willie Nelson with David Ritz
7644,6/6/2015,6/21/2015,,,14.0,62301233,9.78006E+12,"A technology writer follows Musk’s life from his difficult South African childhood to his involvement in Internet start-ups like the rocket company SpaceX, the electric-car company Tesla and the solar power installation company Solar City.",ELON MUSK,Ashlee Vance
7664,6/6/2015,6/21/2015,,,17.0,62398083,9.78006E+12,"The widow of Chris Kyle, of “American Sniper” fame, describes her life after his death.",AMERICAN WIFE,Taya Kyle with Jim DeFelice
7670,6/6/2015,6/21/2015,,,18.0,385353405,9.78039E+12,"How Washington, Hamilton, Jay and Madison created the Constitution.",THE QUARTET,Joseph J Ellis
7676,6/6/2015,6/21/2015,,,19.0,62369288,9.78006E+12,An examination of donations made to the Clinton Foundation by foreign entities.,CLINTON CASH,Peter Schweizer
7682,6/6/2015,6/21/2015,,,20.0,525954678,9.78053E+12,"The actor, formerly a star in “Parks and Recreation,” takes a humorous look at what makes great Americans great.",GUMPTION,Nick Offerman
7712,8/18/2012,9/2/2012,,,4.0,62136747,9.78006E+12,The goalkeeper for the U.S. women’s soccer team chronicles her career and her hardscrabble upbringing.,SOLO,Hope Solo with Ann Killion
7718,8/18/2012,9/2/2012,,,5.0,1596987782,9.7816E+12,An argument that President Obama is the architect of American decline.,OBAMA'S AMERICA,Dinesh D'Souza
7743,8/18/2012,9/2/2012,,,9.0,307888762,9.78031E+12,How the Allies tricked the Nazis into believing that on D-Day they would attack somewhere other than Normandy.,DOUBLE CROSS,Ben Macintyre
7763,8/18/2012,9/2/2012,,,12.0,307272222,9.78031E+12,"A biography of Julia Child, published to coincide with what would have been her 100th birthday.",DEARIE,Bob Spitz
7784,8/18/2012,9/2/2012,,,15.0,1451691564,9.78145E+12,"Marton recalls her marriages to Peter Jennings and Richard Holbrooke, set against the backdrop of Paris.",PARIS: A LOVE STORY,Kati Marton
7852,2/25/2017,3/12/2017,,,4.0,62464310,9.78006E+12,A provocative look into the future by the author of “Sapiens.”,HOMO DEUS,Yuval Noah Harari
7858,2/25/2017,3/12/2017,,,5.0,None,9.78006E+12,"This book by the newly appointed national security adviser, originally published in 1997, argues that officers of the Joint Chiefs of Staff failed to give President Johnson candid advice about the Vietnam War.",DERELICTION OF DUTY,H R McMaster
7887,2/25/2017,3/12/2017,,,9.0,1630060879,9.78163E+12,A battle plan for the Trump White House.,BIG AGENDA,David Horowitz
7899,2/25/2017,3/12/2017,,,11.0,718090195,9.78072E+12,"The songwriter describes his difficult childhood, love for his wife, and her death from cancer in 2016.",THIS LIFE I LIVE,Rory Feek
7905,2/25/2017,3/12/2017,,,12.0,125007701X,9.78125E+12,A humorous treatment of the author’s experience of depression and anxiety disorder.,FURIOUSLY HAPPY,Jenny Lawson
7935,7/14/2018,7/29/2018,,,2.0,60899220,9.78006E+12,A memoir-exposé of the restaurant world. Originally published in 2000.,KITCHEN CONFIDENTIAL,Anthony Bourdain
7943,7/14/2018,7/29/2018,,,3.0,316392383,9.78032E+12,"A collection of comedic stories on mortality, middle age and a beach house dubbed the Sea Section.",CALYPSO,David Sedaris
7951,7/14/2018,7/29/2018,,,4.0,038534919X,9.78039E+12,Three decades’ worth of essays from the recently deceased conservative columnist.,THINGS THAT MATTER,Charles Krauthammer
7963,7/14/2018,7/29/2018,,,6.0,399589813,9.7804E+12,The present political climate is contextualized through the lens of difficult moments in American history.,THE SOUL OF AMERICA,Jon Meacham
7969,7/14/2018,7/29/2018,,,7.0,1501135945,9.7815E+12,"A newly researched look into the sinking of the U.S.S. Indianapolis, the story of the survivors and the fight to exonerate the court-martialed skipper.",INDIANAPOLIS,Lynn Vincent and Sara Vladic
7992,7/14/2018,7/29/2018,,,10.0,1594204225,9.78159E+12,A personal account of how psychedelics might help the mentally ill and people dealing with everyday challenges.,HOW TO CHANGE YOUR MIND,Michael Pollan
7998,7/14/2018,7/29/2018,,,11.0,316484814,9.78032E+12,The former U.S. intelligence officer describes the tools and techniques used by Vladimir Putin to affect the 2016 election.,THE PLOT TO DESTROY DEMOCRACY,Malcolm Nance
8014,7/14/2018,7/29/2018,,,13.0,525509135,9.78053E+12,A memoir by a woman who went from working many part-time jobs to becoming one of President Obama's stenographers.,FROM THE CORNER OF THE OVAL,Beck Dorey-Stein
8033,12/25/2021,1/9/2022,Combined Print & E-Book Nonfiction,15.0,1.0,63076098,9.78006E+12,A memoir by the musician known for his work with Foo Fighters and Nirvana.,THE STORYTELLER,Dave Grohl
8039,12/25/2021,1/9/2022,,,2.0,1984877925,9.78198E+12,"The actor, producer and musician tells his life story and lessons he learned along the way.",WILL,Will Smith with Mark Manson
8051,12/25/2021,1/9/2022,,,4.0,593230574,9.78059E+12,"Viewing America’s entanglement with slavery and its legacy, in essays adapted and expanded from The New York Times Magazine.",THE 1619 PROJECT,"edited  Nikole Hannah-Jones, Caitlin Roper, Ilena Silverman and Jake Silverstein"
8057,12/25/2021,1/9/2022,,,5.0,163149256X,9.78163E+12,"A two-volume celebration of 154 songs, with handwritten texts, paintings and photographs from the songwriter’s archives.",THE LYRICS: 1956 TO THE PRESENT,Paul McCartney
8063,12/25/2021,1/9/2022,,,6.0,525540571,9.78053E+12,The Fox News host gives an account of the relationship between Abraham Lincoln and Frederick Douglass.,THE PRESIDENT AND THE FREEDOM FIGHTER,Brian Kilmeade
8069,12/25/2021,1/9/2022,,,7.0,593236319,9.78059E+12,Conversations between the 44th president and the multiple award-winning musician on a range of topics.,RENEGADES,Barack Obama and Bruce Springsteen
8075,12/25/2021,1/9/2022,,,8.0,63046644,9.78006E+12,A collection of holiday memories from members of the staff of Fox News.,ALL AMERICAN CHRISTMAS,Rachel Campos-Duffy and Sean Duffy
8087,12/25/2021,1/9/2022,,,10.0,1982168013,9.78198E+12,"The award-winning actor reflects on his career, Italian-American heritage, meals and mishaps.",TASTE,Stanley Tucci
8099,12/25/2021,1/9/2022,,,12.0,60959479,9.78006E+12,The late feminist icon explores the causes of a polarized society and the meaning of love.,ALL ABOUT LOVE,bell hooks
8105,12/25/2021,1/9/2022,,,13.0,None,9.78173E+12,"The story of the making of the band’s final album, gathered from transcripts of their conversations.",THE BEATLES: GET BACK,the Beatles
8111,12/25/2021,1/9/2022,,,14.0,316494372,9.78032E+12,"A biography of Barry Slotnick, whose clients have included Bette Midler, John Gotti and Bernhard Goetz.",THE DEFENSE LAWYER,James Patterson and Benjamin Wallace
8117,12/25/2021,1/9/2022,,,15.0,059315911X,9.78059E+12,"The EGOT and Kennedy Center honoree shares stories about making comedy for the stage, film and television.",ALL ABOUT ME!,Mel Brooks
8187,1/21/2012,2/5/2012,,,9.0,158836044X,9.78159E+12,The life of the minor 18th-century German princess who became Empress of All the Russias.,CATHERINE THE GREAT,Robert K Massie
8212,1/21/2012,2/5/2012,,,13.0,316098752,9.78032E+12,The ups and downs of building a life in the White House.,THE OBAMAS,Jodi Kantor
8218,1/21/2012,2/5/2012,,,14.0,1400067898,9.7814E+12,The public and private lives of Queen Elizabeth II as she approaches her Diamond Jubilee.,ELIZABETH THE QUEEN,Sally Bedell Smith
8224,1/21/2012,2/5/2012,,,15.0,145162445X,9.78145E+12,A cosmologist’s account of how our universe evolved.,A UNIVERSE FROM NOTHING,Lawrence M Krauss
8230,1/21/2012,2/5/2012,,,16.0,None,2.94001E+12,A memoir of a childhood of physical and mental abuse beginning in first grade and continuing for years.,WHY ME?,Sarah Burleton
8256,1/21/2012,2/5/2012,,,20.0,446585033,9.78045E+12,A collection of humor pieces from the stand-up comedian and talk-show host.,SERIOUSLY... I'M KIDDING,Ellen DeGeneres
8274,9/24/2011,10/9/2011,,,3.0,,9.78006E+12,"President Obama and his advisers, often at odds with one another, respond to the economic crisis.",CONFIDENCE MEN,Ron Suskind
8304,9/24/2011,10/9/2011,,,7.0,1594202834,9.78159E+12,"How the need for energy — especially, but not only, oil — drives global political and economic change.",QUEST,Daniel Yergin
8335,9/24/2011,10/9/2011,,,12.0,385526261,9.78039E+12,The life and death by assassination (and medical malpratice) of President James A. Garfield.,DESTINY OF THE REPUBLIC,Candice Millard
8341,9/24/2011,10/9/2011,,,13.0,307718921,9.78031E+12,McGinniss moved to Wasilla to report on the career of Sarah Palin.,THE ROGUE,Joe McGinniss
8376,9/24/2011,10/9/2011,,,18.0,62079131,9.78006E+12,"Cannon’s memoir discusses her romance with the actor Cary Grant, their glamorous careers and stormy marriage, and his dark family secrets. Originally published in 2011.",DEAR CARY,Dyan Cannon
8382,9/24/2011,10/9/2011,,,19.0,1594203075,9.78159E+12,Baumeister and Tierney set out to revolutionize our understanding of the virtue of self-control.,WILLPOWER,Roy F Baumeister and John Tierney
8486,6/18/2016,7/3/2016,Combined Print & E-Book Nonfiction,15.0,1.0,1627797890,9.78163E+12,Stories of the American Revolution; a companion volume to the Fox News series.,BILL O'REILLY'S LEGENDS AND LIES: THE PATRIOTS,David Fisher
8528,6/18/2016,7/3/2016,,,8.0,62442562,9.78006E+12,"The performer looks back at his career, his tumultuous marriage to Whitney Houston and his relationship with their daughter, Bobbi Kristina.",EVERY LITTLE STEP,Bob Brown with Nick Chiles
8554,6/18/2016,7/3/2016,,,12.0,1476733503,9.78148E+12,An overview of the history and science of genetics by the Pulitzer Prize-winning author of “The Emperor of All Maladies.”,THE GENE,Siddhartha Mukherjee
8574,6/18/2016,7/3/2016,,,15.0,393245446,9.78039E+12,The science that attempts to overcome the challenges soldiers face.,GRUNT,Mary Roach
8600,6/18/2016,7/3/2016,,,19.0,1455566381,9.78146E+12,"How modern society’s loss of the sense of belonging — now achieved mostly in the military and in disasters — has led to income inequality, incivility and mental disorders like PTSD.",TRIBE,Sebastian Junger
