,results__bestsellers_date,results__published_date,results__display_name,results__normal_list_ends_at,results__books__rank,results__books__primary_isbn10,results__books__primary_isbn13,results__books__description,results__books__title,results__books__author
30319,8/23/2014,9/7/2014,,,20.0,374531269,9.78037E+12,A former child soldier's killing spree and return to humanity.,A LONG WAY GONE,Ishmael Beah
30372,8/26/2017,9/10/2017,,,8.0,393089746,9.78039E+12,"The daily accounts by a Jewish schoolgirl from Prague, who survived the concentration camps in Terezín and Auschwitz.",HELGA'S DIARY,Helga Weiss
30449,4/9/2016,4/24/2016,,,5.0,None,9.78031E+12,"Benjamin Franklin’s youngest sister, Jane Franklin Mecom (1712-94), married at 15, bore 12 children and led a life of hardship. But she was also a shrewd political commentator, and her correspondence with her brother stretched across more than 60 years. Originally published in 2013.",BOOK OF AGES,Jill Lepore
30467,4/9/2016,4/24/2016,,,8.0,031630607X,9.78032E+12,"A longtime tech writer, age 52, takes a job at a start-up called HubSpot.",DISRUPTED,Dan Lyons
30523,4/9/2016,4/24/2016,,,17.0,1101907061,9.7811E+12,"Essays about life with an over-involved parent, based on the Instagram account @CrazyJewishMom.","MOTHER, CAN YOU NOT?",Kate Siegel
30543,4/9/2016,4/24/2016,,,20.0,1101902965,9.7811E+12,"The actress shares the continuing story of her mother's rare form of dementia, ""primary progressive aphasia,"" from early-onset diagnosis at age 62 through the present.",WHERE THE LIGHT GETS IN,Kimberly Williams-Paisley
30657,9/3/2011,9/18/2011,,,17.0,1414336071,9.78141E+12,"After a coma, an incredible story.",THE BOY WHO CAME BACK FROM HEAVEN,Kevin Malarkey and Alex Malarkey
30675,9/3/2011,9/18/2011,,,20.0,316037702,9.78032E+12,A onetime “most wanted” criminal of cyberspace recounts his exploits.,GHOST IN THE WIRES,Kevin Mitnick with William L Simon
30687,7/8/2017,7/23/2017,,,2.0,069289344X,9.78069E+12,The alt-right provocateur criticizes political correctness.,DANGEROUS,Milo Yiannopoulos
30740,7/8/2017,7/23/2017,,,10.0,62390872,9.78006E+12,What big data — the information now available online — reveals about people's attitudes and behavior.,EVERYBODY LIES,Seth Stephens-Davidowitz
30817,12/5/2020,12/20/2020,,,7.0,63046547,9.78006E+12,The Fox News host and former combat veteran interviews soldiers about the different kinds of battles they encountered.,MODERN WARRIORS,Pete Hegseth
30841,12/5/2020,12/20/2020,,,11.0,62950495,9.78006E+12,The MSNBC host and former congressman describes the struggles Harry Truman faced before and during his time as president.,SAVING FREEDOM,Joe Scarborough
30865,12/5/2020,12/20/2020,,,15.0,1982171863,9.78198E+12,The leader of the Roman Catholic Church shares difficult experiences and mines lessons from the pandemic.,LET US DREAM,Pope Francis and Austin Ivereigh
30939,7/12/2014,7/27/2014,,,11.0,679603972,9.78068E+12,A study of Britain’s crucial role in the American Civil War.,A WORLD ON FIRE,Amanda Foreman
30965,7/12/2014,7/27/2014,,,15.0,307490882,9.78031E+12,"The story of the U.S.S. Houston, a cruiser doomed in the aftermath of Pearl Harbor, and the ordeal of its crew; first published in 2006.",SHIP OF GHOSTS,James D Hornfischer
30983,7/12/2014,7/27/2014,,,18.0,345521935,9.78035E+12,The unexpected rise of one of Britain’s most influential monarchs.,BECOMING QUEEN VICTORIA,Kate Williams
31058,5/4/2013,5/19/2013,,,10.0,1401943411,9.7814E+12,The founder of Re/Max recounts his ordeal with a staph infection that left him paralyzed.,MY NEXT STEP,Dave Liniger with Laura Morton
31086,5/4/2013,5/19/2013,,,14.0,307415473,9.78031E+12,An account of the powerful English king and his court.,HENRY VIII,Alison Weir
31350,12/14/2013,12/29/2013,,,20.0,316614351,9.78032E+12,"A thrilling and honest biography of Ted Williams (1918-2002), the Boston Red Sox slugger and war hero who was all too human when he stepped away from the game.",THE KID,Ben Bradlee Jr
31380,10/24/2020,11/8/2020,,,5.0,1684511348,9.78168E+12,The Republican senator from Texas gives his views on what might happen if liberals gain a simple majority on the Supreme Court.,ONE VOTE AWAY,Ted Cruz
31386,10/24/2020,11/8/2020,,,6.0,316492736,9.78032E+12,Photographs and stories of more than 200 locations from around the world that are inspired by the aesthetic of the film director Wes Anderson.,ACCIDENTALLY WES ANDERSON,Wally Koval
31404,10/24/2020,11/8/2020,,,9.0,198213173X,9.78198E+12,"Based on 17 on-the-record interviews with President Trump and other reporting, the Pulitzer Prize-winning journalist details the president’s perspective on multiple crises.",RAGE,Bob Woodward
31410,10/24/2020,11/8/2020,,,10.0,63042940,9.78006E+12,A look at the potential factors that led to the divergent life paths of Prince William and Prince Harry.,BATTLE OF BROTHERS,Robert Lacey
31428,10/24/2020,11/8/2020,,,13.0,393542130,9.78039E+12,The CNN host posits what might happen on the other side of the Covid-19 pandemic.,TEN LESSONS FOR A POST-PANDEMIC WORLD,Fareed Zakaria
31434,10/24/2020,11/8/2020,,,14.0,1982163658,9.78198E+12,The president of Judicial Watch gives his opinions on forces he sees as detrimental to the Trump presidency.,A REPUBLIC UNDER ASSAULT,Tom Fitton
31440,10/24/2020,11/8/2020,,,15.0,316425311,9.78032E+12,"Key career moments are recounted by the musician inducted into the 2020 Grammy Hall of Fame for his album ""Frampton Comes Alive!""",DO YOU FEEL LIKE I DO?,Peter Frampton with Alan Light
31476,7/20/2013,8/4/2013,,,6.0,1594486255,9.78159E+12,The senior fantasy sports analyst for ESPN celebrates the fantasy sports world. ,FANTASY LIFE,Matthew Berry
31648,2/4/2012,2/19/2012,,,10.0,143918769X,9.78144E+12,Recollections of John F. Kennedy Jr. from his former personal assistant and confidante.,FAIRY TALE INTERRUPTED,RoseMarie Terenzio
31697,2/4/2012,2/19/2012,,,18.0,62098047,9.78006E+12,A memoir and satirical look at the complexities of racial politics.,HOW TO BE BLACK,Baratunde Thurston
31753,1/5/2013,1/20/2013,,,7.0,None,9.7811E+12,"Tracking dinner from the soil to the plate, a journalist juggles appetite and conscience; originally published in 2006.",THE OMNIVORE’S DILEMMA,Michael Pollan
31917,8/12/2017,8/27/2017,,,12.0,1439187886,9.78144E+12,"A biography of the Princess of Wales, who died at the age of 36 in 1997. Originally published in 1992.",DIANA,Andrew Morton
32056,7/30/2016,8/14/2016,,,18.0,1501127241,9.7815E+12,,THE LAST PUNISHER,Kevin Lacz and Lindsey Lacz
32166,3/22/2014,4/6/2014,,,13.0,60539186,9.78006E+12,"The first volume of a cultural history, a tie-in to the PBS series, covers the years 1000 B.C. to 1492 A.D.",THE STORY OF THE JEWS,Simon Schama
32178,3/22/2014,4/6/2014,,,15.0,,9.7813E+12,"Collects ""Princess"" (1993), ""Princess Sultana's Daughters"" (1994) and ""Princess Sultana's Circle"" (2002).",THE PRINCESS TRILOGY,Jean Sasson
32269,3/18/2017,4/2/2017,,,9.0,735213291,9.78074E+12,"An argument that, rather than engaging in politics, Christians should withdraw from mainstream culture and focus on strengthening their families, churches and schools.",THE BENEDICT OPTION,Rod Dreher
32389,6/1/2019,6/16/2019,,,14.0,62956582,9.78006E+12,A collection of photographs and remembrances by some who were impacted by the chef and television host.,ANTHONY BOURDAIN REMEMBERED,CNN
32395,6/1/2019,6/16/2019,,,15.0,1101980281,9.7811E+12,A retracing of Frederick Law Olmsted's time as an undercover correspondent during the 1850s in the South for The New York Times and one of the designers of Central Park.,SPYING ON THE SOUTH,Tony Horwitz
32492,4/13/2013,4/28/2013,,,15.0,None,9.78145E+12,"A journalist’s investigation into the mysterious death of his father, himself a newspaperman who had worked in a vanished world of Chicago journalism.",AFTER VISITING FRIENDS,Michael Hainey
32603,3/17/2018,4/1/2018,,,11.0,1101985909,9.7811E+12,An insider look at the Bachelor franchise and its effect on society.,BACHELOR NATION,Amy Kaufman
32615,3/17/2018,4/1/2018,,,13.0,042528462X,9.78043E+12,An argument for taking on risk.,SKIN IN THE GAME,Nassim Nicholas Taleb
32652,10/10/2020,10/25/2020,,,3.0,358126606,9.78036E+12,A look at the design and architecture of various and sometimes unexpected elements that make cities function.,THE 99% INVISIBLE CITY,Roman Mars and Kurt Kohlstedt
32682,10/10/2020,10/25/2020,,,8.0,1250241774,9.78125E+12,The former C.I.A. director recounts key moments from his career and evaluates national security policies and actions.,UNDAUNTED,John O Brennan
32688,10/10/2020,10/25/2020,,,9.0,1250164680,9.78125E+12,"The career highlights, public life and private struggles of the singer and songwriter.",THE MEANING OF MARIAH CAREY,Mariah Carey with Michaela Angela Davis
32712,10/10/2020,10/25/2020,,,13.0,1631498770,9.78163E+12,The former mayor of South Bend and 2020 Democratic presidential candidate prescribes ways to restore what he considers an essential element of America’s democracy.,TRUST,Pete Buttigieg
32724,10/10/2020,10/25/2020,,,15.0,1250113083,9.78125E+12,The musician reflects on how opposing elements created balance in his life.,LET LOVE RULE,Lenny Kravitz with David Ritz
32801,8/17/2019,9/1/2019,,,12.0,1476775389,9.78148E+12,How Koch Industries consolidated power and affected important facets of modern life over the last half-century.,KOCHLAND,Christopher Leonard
32819,8/17/2019,9/1/2019,,,15.0,802125085,9.7808E+12,Identity and inequality are explored in the history of a family and home in New Orleans both before and after Hurricane Katrina.,THE YELLOW HOUSE,Sarah M Broom
32910,1/21/2017,2/5/2017,,,14.0,62426974,9.78006E+12,An argument for the durability of Obama's legacy.,AUDACITY,Jonathan Chait
32916,1/21/2017,2/5/2017,,,15.0,399592466,9.7804E+12,Dispatches from the 2016 campaign.,INSANE CLOWN PRESIDENT,Matt Taibbi
32958,12/1/2012,12/16/2012,,,7.0,1400067820,9.7814E+12,The philosophical essayist and author of “The Black Swan” identifies things that not only gain from chaos but need it in order to survive and flourish.,ANTIFRAGILE,Nassim Nicholas Taleb
32970,12/1/2012,12/16/2012,,,9.0,1451648308,9.78145E+12,The 16th collection in the Crime Files true-crime series.,"FATAL FRIENDS, DEADLY NEIGHBORS",Ann Rule
32982,12/1/2012,12/16/2012,,,11.0,316547700,9.78032E+12,"A biography of Winston Churchill, reaching from World War II until his death in 1965.",LAST LION,William Manchester and Paul Reid
33001,12/1/2012,12/16/2012,,,13.0,743236718,9.78074E+12,The difficulties and triumphs of families dealing with exceptional children.,FAR FROM THE TREE,Andrew Solomon
33007,12/1/2012,12/16/2012,,,14.0,62193643,9.78006E+12,"The musician muses on family, friends, Texas and life on the road.",ROLL ME UP AND SMOKE ME WHEN I DIE,Willie Nelson
33019,12/1/2012,12/16/2012,,,16.0,1591845734,9.78159E+12,"A collection of updated Fortune magazine articles on Warren Buffett, published between 1966 and 2012.",TAP DANCING TO WORK,Carol J Loomis
33025,12/1/2012,12/16/2012,,,17.0,385535643,9.78039E+12,A career that spanned every aspect of the hotel industry inspired this author to share insider secrets to getting the best service.,HEADS IN BEDS,Jacob Tomsky
33037,12/1/2012,12/16/2012,,,19.0,316185396,9.78032E+12,The story of a deadly Taliban attack on a remote American outpost in Afghanistan in 2009 sheds light on the war.,THE OUTPOST,Jake Tapper
33043,12/1/2012,12/16/2012,,,20.0,7279752,9.78001E+12,"An account, first published in 2007, of a foster mother who tries to save a violent and aggressive 8-year-old girl whose parents were involved in a pedophile ring.",DAMAGED,Cathy Glass
33055,2/13/2016,2/28/2016,,,2.0,1501135120,9.7815E+12,"One of the “Real Housewives of New Jersey” looks back on her life, including time in prison following a federal fraud conviction.",TURNING THE TABLES,Teresa Giudice
33119,2/13/2016,2/28/2016,,,12.0,1101875550,9.7811E+12,"The Pulitzer Prize-winning novelist describes learning to write in another language, Italian.",IN OTHER WORDS,Jhumpa Lahiri
33139,2/13/2016,2/28/2016,,,15.0,812998405,9.78081E+12,An oral history of five significant Los Angeles families.,WEST OF EDEN,Jean Stein
33163,2/13/2016,2/28/2016,,,19.0,1620877562,9.78162E+12,"A monsignor who saved Allied war prisoners and civilians, including Jews, during the \nGerman occupation of Rome. Originally published in 2008.",THE VATICAN PIMPERNEL,Brian Fleming
33217,4/27/2019,5/12/2019,,,8.0,1250243734,9.78125E+12,The author of “Magicians of the Gods” makes his case about the origins of civilizations.,AMERICA BEFORE,Graham Hancock
33258,4/27/2019,5/12/2019,,,14.0,812996100,9.78081E+12,The Pulitzer Prize-winning columnist observes the joys of being a grandmother.,NANAVILLE,Anna Quindlen
33282,2/16/2019,3/3/2019,,,3.0,1404110828,9.7814E+12,The Oscar-nominated actor describes how he has entertained troops and helped veterans.,GRATEFUL AMERICAN,Gary Sinise with Marcus Brotherton
33341,2/16/2019,3/3/2019,,,12.0,1501134647,9.7815E+12,"An account of the 1986 disaster at the Chernobyl nuclear power plant, based on hundreds of hours of interviews.",MIDNIGHT IN CHERNOBYL,Adam Higginbotham
33419,6/2/2012,6/17/2012,,,9.0,307730697,9.78031E+12,"A tribute to Adam Brown, a member of Navy SEAL Team 6, who was killed in Afghanistan.",FEARLESS,Eric Blehm
33566,8/10/2019,8/25/2019,,,12.0,525521038,9.78053E+12,"A collection of essays and speeches written over four decades, including a eulogy for James Baldwin and the author's Nobel lecture.",THE SOURCE OF SELF-REGARD,Toni Morrison
33666,4/29/2017,5/14/2017,,,12.0,1501145304,9.7815E+12,The radio personality presents his life story and offers advice for success.,BLACK PRIVILEGE,Charlamagne Tha God
33678,4/29/2017,5/14/2017,,,14.0,1400078458,9.7814E+12,A New Yorker writer searches for a British explorer who disappeared in the Amazon in 1925. Originally published in 2009 and the basis of the 2017 movie.,THE LOST CITY OF Z,David Grann
33778,6/4/2016,6/19/2016,,,15.0,62262262,9.78006E+12,"A collection of nonfiction essays on such topics as art, dreams, myth and memories.",THE VIEW FROM THE CHEAP SEATS,Neil Gaiman
33816,6/4/2016,6/19/2016,,,20.0,62484222,9.78006E+12,"A look at the various ways the movie franchise illuminates political, moral, and familial themes.",THE WORLD ACCORDING TO STAR WARS,Cass R Sunstein
33871,9/1/2012,9/16/2012,,,8.0,1451657498,9.78145E+12,A biography of the legendary Penn State football coach.,PATERNO,Joe Posnanski
34058,1/16/2016,1/31/2016,,,16.0,1616202750,9.78162E+12,A memoir by a woman who falls in love with a city and a man. Originally published in 2013.,A THOUSAND DAYS IN VENICE,Marlena de Blasi
34076,1/16/2016,1/31/2016,,,19.0,345521412,9.78035E+12,,THE LOST TUDOR PRINCESS,Alison Weir
34128,1/20/2018,2/4/2018,,,7.0,62843435,9.78006E+12,Photographs and profiles of the organizers and participants of the 2017 Women’s March.,TOGETHER WE RISE,Women's March Organizers and Condé Nast
34140,1/20/2018,2/4/2018,,,9.0,735222916,9.78074E+12,The historian uses network theory to understand the past and the present.,THE SQUARE AND THE TOWER,Niall Ferguson
34358,1/28/2017,2/12/2017,,,13.0,1621574903,9.78162E+12,"The investigation that led to the conviction for murder of Dr. Kermit Gosnell, a doctor who ran a grisly Philadelphia abortion clinic.",GOSNELL,Ann McElhinney and Phelim McAleer
34491,7/19/2014,8/3/2014,,,18.0,307764990,9.78031E+12,The autobiography of the general who commanded the allied forces in the Persian Gulf war of 1991; first published in 1992.,IT DOESN'T TAKE A HERO,H Norman Schwarzkopf with Peter Petre
34503,7/19/2014,8/3/2014,,,20.0,None,9.78076E+12,The founder of ShrinkTalk.net explains how he deals with his own personal problems and those of the people he treats.,CRAZY,Rob Dobrenski
34533,4/7/2012,4/22/2012,,,5.0,006208397X,9.78006E+12,The radio host denounces President Obama’s domestic and foreign policies as tyranny.,TRICKLE DOWN TYRANNY,Michael Savage
34615,4/7/2012,4/22/2012,,,16.0,62045032,9.78006E+12,A mother’s account of the first year of life with a baby with Down syndrome.,BLOOM,Kelle Hampton
34621,4/7/2012,4/22/2012,,,17.0,1401341799,9.7814E+12,"A woman who blogs about her life as a mother, wife and Mormon describes how she and her husband recovered from a terrible plane crash with optimism and faith.",HEAVEN IS HERE,Stephanie Nielson with Amy Ferguson
34627,4/7/2012,4/22/2012,,,18.0,547746725,9.78055E+12,The relationship between Yankees pitching great Ron Guidry and the Hall of Fame catcher Yogi Berra at the team’s spring training in Tampa.,DRIVING MR. YOGI,Harvey Araton
34698,10/18/2014,11/2/2014,,,8.0,1501105132,9.7815E+12,An examination of the jihadist group and a warning about its dangers.,RISE OF ISIS,Jay Sekulow with Jordan Sekulow and others
34716,10/18/2014,11/2/2014,,,11.0,1594205965,9.78159E+12,The writer’s experience in the Obama administration as director of the C.I.A. and secretary of defense.,WORTHY FIGHTS,Leon Panetta with Jim Newton
34734,10/18/2014,11/2/2014,,,14.0,,9.78006E+12,"The actor’s memoir describes his abusive father and his family’s secrets as well as his experiences in theater, movies and television.",NOT MY FATHER'S SON,Alan Cumming
34777,10/18/2014,11/2/2014,,,20.0,1476714541,9.78148E+12,A memoir by the Aerosmith guitarist and songwriter.,ROCKS,Joe Perry with David Ritz
34848,7/6/2019,7/21/2019,,,11.0,525533982,9.78053E+12,A memoir by the professional basketball player for the Golden State Warriors and 2012 N.B.A. All-Star.,THE SIXTH MAN,Andre Iguodala with Carvell Wallace
34860,7/6/2019,7/21/2019,,,13.0,None,9.7807E+12,"How the F.B.I. caught Israel Keyes, a serial killer who, for 14 years, attacked victims across the country and returned to his quiet life in Alaska.",AMERICAN PREDATOR,Maureen Callahan
34872,7/6/2019,7/21/2019,,,15.0,62880101,9.78006E+12,The MSNBC host gives her analysis of Donald Trump’s presidency.,THE MAN WHO SOLD AMERICA,Joy-Ann Reid
34916,6/20/2015,7/5/2015,,,7.0,62417444,9.78006E+12,A celebration of the resilience of the English language; first published in 1990 and just reissued.,THE MOTHER TONGUE,Bill Bryson
34989,6/20/2015,7/5/2015,,,17.0,1400063361,9.7814E+12,The hunt for a 17th-century pirate ship.,PIRATE HUNTERS,Robert Kurson
35001,6/20/2015,7/5/2015,,,19.0,1627790837,9.78163E+12,"An award-winning journalist’s chilling account of the Nixon  presidency, based in part on recently declassified material.\n",ONE MAN AGAINST THE WORLD,Tim Weiner
35087,1/18/2014,2/2/2014,,,11.0,1476733767,9.78148E+12,"The challenges of midlife, presented with humor and insight by the broadcast journalist.",YOUR LIFE CALLING,Jane Pauley
35118,1/18/2014,2/2/2014,,,15.0,,9.78068E+12,"A journey inside the world of Fox News and the life of its combative, visionary founder, Roger Ailes.",THE LOUDEST VOICE IN THE ROOM,Gabriel Sherman
35190,9/27/2014,10/12/2014,,,5.0,1555846157,9.78156E+12,"A political biography of Theodore, Franklin and Eleanor Roosevelt; first published in 2001.",THE THREE ROOSEVELTS,James MacGregor Burns and Susan Dunn
35202,9/27/2014,10/12/2014,,,7.0,767928474,9.78077E+12,A woman’s account of her flight from a fundamentalist polygamous sect; first published in 2007.,ESCAPE,Carolyn Jessop
35214,9/27/2014,10/12/2014,,,9.0,,9.78148E+12,The story of a brilliant young man from a New Jersey ghetto who graduated from Yale but was murdered as a drug dealer at age 30.,THE SHORT AND TRAGIC LIFE OF ROBERT PEACE,Jeff Hobbs
35244,9/27/2014,10/12/2014,,,14.0,307237818,9.78031E+12,A portrayal of the conqueror as a visionary; first published in 2004.,GENGHIS KHAN AND THE MAKING OF THE MODERN WORLD,Jack Weatherford
35250,9/27/2014,10/12/2014,,,15.0,None,2.94002E+12,"A biography of Truman Capote, the basis for the 2005 film; first published in 1988.",CAPOTE,Gerald Clarke
35262,9/27/2014,10/12/2014,,,17.0,307700232,9.78031E+12,"A companion volume to the PBS series examines the lives of Theodore, Eleanor and Franklin.",THE ROOSEVELTS,Geoffrey C Ward and Ken Burns
35340,6/25/2016,7/10/2016,,,10.0,006231078X,9.78006E+12,The story of a mixed-race girl raised as a lady in 18th-century England; the inspiration for the 2014 movie.,BELLE,Paula Byrne
35455,4/19/2014,5/4/2014,,,8.0,006223062X,9.78006E+12,"Two journalists interview women in positions of leadership, examine research about confidence and discuss how women can achieve it.",CONFIDENCE CODE,Katty Kay and Claire Shipman
35461,4/19/2014,5/4/2014,,,9.0,61792802,9.78006E+12,How to apply economic theory to almost everything. ,FREAKONOMICS,Steven D Levitt and Stephen J Dubner
35479,4/19/2014,5/4/2014,,,11.0,1594205736,9.78159E+12,The coach of the University of Kentucky’s men’s basketball team discusses the game and his career.,PLAYERS FIRST,John Calipari and Michael Sokolove
35531,4/19/2014,5/4/2014,,,18.0,,9.78145E+12,The actor’s second book of stories and observations.,LOVE LIFE,Rob Lowe
35537,4/19/2014,5/4/2014,,,19.0,62114042,9.78006E+12,A memoir by the Kiss rhythm guitarist.,FACE THE MUSIC,Paul Stanley
35567,3/5/2016,3/20/2016,,,4.0,None,9.78163E+12,The story of the World War II British spymaster who became Churchill’s secret intelligence ambassador to Roosevelt.,A MAN CALLED INTREPID,William Stevenson
35617,3/5/2016,3/20/2016,,,12.0,385353928,9.78039E+12,How social media has changed the way girls grow up.,AMERICAN GIRLS,Nancy Jo Sales
35623,3/5/2016,3/20/2016,,,13.0,62386980,9.78006E+12,A television producer's memoir of growing up with a troubled mother.,WHITE DRESSES,Mary Pflum Peterson
35635,3/5/2016,3/20/2016,,,15.0,767908961,9.78077E+12,"The government's case in the Archer Daniels Midland price-fixing scandal of the mid-1990s was based on the testimony of an executive who was an informant, but he turned out to be untrustworthy. Originally published in 2000; a 2009 movie.",THE INFORMANT,Kurt Eichenwald
35655,3/5/2016,3/20/2016,,,18.0,1476716560,9.78148E+12,"An investigation into the lives of unmarried women, both their modern experiences and concerns and their role in American history and culture.",ALL THE SINGLE LADIES,Rebecca Traister
35712,7/11/2015,7/26/2015,,,7.0,006209291X,9.78006E+12,Four courageous women in the Civil War.,"LIAR, TEMPTRESS, SOLDIER, SPY",Karen Abbott
35738,7/11/2015,7/26/2015,,,11.0,1588369897,9.78159E+12,A tribute to a deep friendship between two women writers. Originally published in 2010.,LET'S TAKE THE LONG WAY HOME,Gail Caldwell
35756,7/11/2015,7/26/2015,,,14.0,61867462,9.78006E+12,"The news analyst details the lives of the many women (Abigail Adams and Martha Washington among them) who ""raised our nation.""  Originally published in 2004.",FOUNDING MOTHERS,Cokie Roberts
35830,5/8/2021,5/23/2021,,,5.0,052565609X,9.78053E+12,"An ecologist describes ways trees communicate, cooperate and compete.",FINDING THE MOTHER TREE,Suzanne Simard
35842,5/8/2021,5/23/2021,,,7.0,1250799244,9.78125E+12,The senior senator from Massachusetts shares six influential perspectives that shaped her life and advocacy.,PERSIST,Elizabeth Warren
35866,5/8/2021,5/23/2021,,,11.0,1684512395,9.78168E+12,"The Republican senator from Missouri gives his assessment of Google, Facebook, Amazon and Apple.",THE TYRANNY OF BIG TECH,Josh Hawley
35890,5/8/2021,5/23/2021,,,15.0,006296058X,9.78006E+12,Essays by the actress and comedian on the ups and downs of womanhood and motherhood.,THE WRECKAGE OF MY PRESENCE,Casey Wilson
35962,9/14/2013,9/29/2013,,,12.0,399159215,9.7804E+12,A new biography of the 28th president. ,WILSON,A Scott Berg
35980,9/14/2013,9/29/2013,,,15.0,,9.78146E+12,A memoir by a woman who helped expose crimes within a polygamous sect that she fled.,THE WITNESS WORE RED,Rebecca Musser with Bridget Cook
35992,9/14/2013,9/29/2013,,,17.0,62131729,9.78006E+12,An oral history of the early years (1972-5) of the band Kiss. ,NOTHIN' TO LOSE,Ken Sharp with Paul Stanley and Gene Simmons
36088,2/15/2014,3/2/2014,,,10.0,62297171,9.78006E+12,"Observations on hooking up, from the “Real Housewives of Beverly Hills” star.",DRINKING AND DATING,Brandi Glanville with Leslie Bruce
36106,2/15/2014,3/2/2014,,,12.0,804136750,9.7808E+12,An account of Hillary Clinton’s years in the State Department.,HRC,Jonathan Allen and Amie Parnes
36154,2/15/2014,3/2/2014,,,20.0,62267558,9.78006E+12,The story of an Iraqi interpreter who spent six years working with American special forces before being brought to safety in America.,CODE NAME: JOHNNY WALKER,"""Johnny Walker"" with Jim DeFelice"
36250,2/1/2014,2/16/2014,,,13.0,307269876,9.78031E+12,"A study of anxiety disorder by the editor of The Atlantic, drawing on research as well as personal experience.",MY AGE OF ANXIETY,Scott Stossel
36270,2/1/2014,2/16/2014,,,16.0,62101307,9.78006E+12,"An out-of-shape newspaperman decides to pay tribute to a deceased friend by climbing all 48 of New Hampshire's 4,000-foot peaks twice in one winter, accompanied by his miniature schnauzer, Atticus.",FOLLOWING ATTICUS,Tom Ryan
36344,1/31/2015,2/15/2015,,,6.0,,9.78145E+12,The author describes a year he spent teaching in a two-room schoolhouse on a remote island off South Carolina.,THE WATER IS WIDE,Pat Conroy
36392,1/31/2015,2/15/2015,,,14.0,307538265,9.78031E+12,A memoir of life as the daughter of Dean Martin.,MEMORIES ARE MADE OF THIS,Deana Martin with Wendy Holden
36407,1/31/2015,2/15/2015,,,16.0,,9.78163E+12,The biography of a language; the companion volume to the History Channel series.,THE ADVENTURE OF ENGLISH,Melvyn Bragg
36419,1/31/2015,2/15/2015,,,18.0,61981362,9.78006E+12,,THE CRUSADES,Thomas Asbridge
36432,1/31/2015,2/15/2015,,,20.0,62297120,9.78006E+12,The stories of three women hidden as children during the Holocaust who survived to lead adult lives in the United States.,SUCH GOOD GIRLS,R D Rosen
36510,3/8/2014,3/23/2014,,,10.0,None,A00B00AHP5NY6,"How a 75-year-old actor, “Star Trek’s” Mr. Sulu, became a star on Twitter, YouTube and Facebook.",OH MYYY! (THERE GOES THE INTERNET),George Takei
