,results__bestsellers_date,results__published_date,results__display_name,results__normal_list_ends_at,results__books__rank,results__books__primary_isbn10,results__books__primary_isbn13,results__books__description,results__books__title,results__books__author
15658,3/19/2016,4/3/2016,,,15.0,62202618,9.78006E+12,"The cookbook writer and host of “Top Chef” traces her life’s journey, beginning in South India.","LOVE, LOSS, AND WHAT WE ATE",Padma Lakshmi
15683,3/19/2016,4/3/2016,,,19.0,1451635117,9.78145E+12,NBC’s chief foreign correspondent discusses the Arab Spring and war in the Middle East.,AND THEN ALL HELL BROKE LOOSE,Richard Engel
15689,3/19/2016,4/3/2016,,,20.0,038553941X,9.78039E+12,A sportswriter’s account of three famous basketball coaches and their rivalry.,THE LEGENDS CLUB,John Feinstein
15713,9/10/2011,9/25/2011,,,4.0,None,9.78142E+12,"A biography of Dietrich Bonhoeffer, a German pastor and theologian who was hanged for the role he played in the assassination plot against Hitler.",BONHOEFFER,Eric Metaxas
15779,9/10/2011,9/25/2011,,,13.0,None,9.7808E+12,"Marlantes, a Vietnam veteran, takes a personal look at the ordeals of combat and its aftermath.",WHAT IT IS LIKE TO GO TO WAR,Karl Marlantes
15791,9/10/2011,9/25/2011,,,15.0,1596981008,9.7816E+12,"The writer foresees Armageddon for the United States, which he maintains has caught up with Europe in the rush to self-destruction.",AFTER AMERICA,Mark Steyn
15803,9/10/2011,9/25/2011,,,17.0,307265722,9.78031E+12,The author says that ecological encounters since Columbus have affected subsequent human history.,1493,Charles C Mann
15809,9/10/2011,9/25/2011,,,18.0,1594202990,9.78159E+12,Fuller’s mother is at the center of this memoir set in Africa.,COCKTAIL HOUR UNDER THE TREE OF FORGETFULNESS,Alexandra Fuller
15870,10/28/2017,11/12/2017,,,8.0,1101986158,9.7811E+12,The memoir of a Muslim-American undercover agent for the F.B.I.’s counterterrorism unit.,AMERICAN RADICAL,Tamer Elnoury with Kevin Maurer
15876,10/28/2017,11/12/2017,,,9.0,1610397215,9.78161E+12,"How corruption, economic inequality and ethnic prejudices were early factors in the fall of the Roman Empire.",THE STORM BEFORE THE STORM,Mike Duncan
15898,10/28/2017,11/12/2017,,,12.0,1418525650,9.78142E+12,The unlikely friendship between a homeless drifter and a successful art dealer who meet at a shelter in Texas.,SAME KIND OF DIFFERENT AS ME,Ron Hall and Denver Moore with Lynn Vincent
16011,7/21/2018,8/5/2018,,,14.0,1476755744,9.78148E+12,An American hedge fund manager in Russia is expelled by kleptocrats who then seize his property. Browder's investigation into the death of his attorney led to the Magnitsky Act.,RED NOTICE,Bill Browder
16104,8/24/2019,9/8/2019,,,13.0,1612198244,9.78161E+12,Discussions with the late chef and TV host from 2003 to 2018.,ANTHONY BOURDAIN: THE LAST INTERVIEW AND OTHER CONVERSATIONS,with an introduction  Helen Rosner
16116,8/24/2019,9/8/2019,,,15.0,None,9.78164E+12,The Fox News contributor and former federal prosecutor makes his case that the narrative of collusion between the 2016 Trump campaign and the Kremlin is a fraud.,BALL OF COLLUSION,Andrew C McCarthy
16140,9/28/2013,10/13/2013,,,4.0,805098208,9.78081E+12,The 65-year-old comedian’s reminiscences and his complaints about aging.,STILL FOOLIN' 'EM,Billy Crystal
16152,9/28/2013,10/13/2013,,,6.0,345545567,9.78035E+12,"The eccentric life of the reclusive heiress Huguette Clark, who died at the age of 104 in 2011.",EMPTY MANSIONS,Bill Dedman and Paul Clark Newell Jr
16170,9/28/2013,10/13/2013,,,9.0,,9.78031E+12,The case of a New Orleans surgeon suspected of euthanizing patients during the Katrina disaster.,FIVE DAYS AT MEMORIAL,Sheri Fink
16194,9/28/2013,10/13/2013,,,13.0,1594202273,9.78159E+12,Accidents and near misses in the management of America’s nuclear arsenal. ,COMMAND AND CONTROL,Eric Schlosser
16218,9/28/2013,10/13/2013,,,16.0,,9.78145E+12,A memoir of a young woman’s brutal kidnapping and 460-day captivity in Somalia.,A HOUSE IN THE SKY,Amanda Lindhout and Sara Corbett
16224,9/28/2013,10/13/2013,,,17.0,62225790,9.78006E+12,A memoir of the childhood and intellectual development by the evolutionary biologist (and famous atheist).,AN APPETITE FOR WONDER,Richard Dawkins
16242,9/28/2013,10/13/2013,,,20.0,345509854,9.78035E+12,Two dogs at Bedlam Farm and an unexpected journey out of darkness.,IZZY AND LENORE,Jon Katz
16303,9/9/2017,9/24/2017,,,9.0,1328771474,9.78133E+12,"The identical twins and reality TV stars trace their ascent from their upbringing in Vancouver, B.C., through personal setbacks to building careers together.",IT TAKES TWO,Jonathan Scott and Drew Scott
16309,9/9/2017,9/24/2017,,,10.0,1492649368,9.78149E+12,"A group of female factory workers get a nickname from the effects of radium paint used at their jobs. Years later, their illnesses are the grounds for a fight for workers' rights.",THE RADIUM GIRLS,Kate Moore
16392,8/31/2013,9/15/2013,,,8.0,62303996,9.78006E+12,"The story of Jodi Arias, who was convicted of murdering her boyfriend, Travis Alexander. ",EXPOSED,Jane Velez-Mitchell
16418,8/31/2013,9/15/2013,,,12.0,,A00B000YN5O2W,How Thomas rebuilt her life after her husband sustained a devastating brain injury in a car accident. Originally published in 2006.,A THREE DOG LIFE,Abigail Thomas
16467,8/31/2013,9/15/2013,,,19.0,812994868,9.78081E+12,A 13-year-old boy with autism answers questions.,THE REASON I JUMP,Naoki Higashida
16488,12/15/2018,12/30/2018,,,2.0,1984825488,9.78198E+12,"A collection of essays, speeches and unpublished writings by the late conservative columnist.",THE POINT OF IT ALL,"Charles Krauthammer,"
16547,12/15/2018,12/30/2018,,,11.0,812995546,9.78081E+12,The story of the New York band who went from performing hardcore punk music to hip hop stardom.,BEASTIE BOYS BOOK,Michael Diamond and Adam Horovitz
16553,12/15/2018,12/30/2018,,,12.0,1101980990,9.7811E+12,A biography focusing on what motivated the war leader and how he learned from his mistakes.,CHURCHILL: WALKING WITH DESTINY,Andrew Roberts
16589,4/2/2016,4/17/2016,,,3.0,312342039,9.78031E+12,"Burroughs's post-rehab social life in 1990s New York City, and its eventual happy ending.",LUST AND WONDER,Augusten Burroughs
16601,4/2/2016,4/17/2016,,,5.0,62209728,9.78006E+12,Interviews with more than 70 teenagers shed light on their experience of sexuality.,GIRLS AND SEX,Peggy Orenstein
16683,4/2/2016,4/17/2016,,,18.0,547973187,9.78055E+12,Americans who fought in and wrote about the Spanish Civil War.,SPAIN IN OUR HEARTS,Adam Hochschild
16689,4/2/2016,4/17/2016,,,19.0,031625875X,9.78032E+12,The mother of a young daughter with Type 1 diabetes tells how their lives changed with the arrival of a dog that detects low blood-sugar levels.,ELLE AND COACH,Stefany Shaheen with Mark Dagostino
16695,4/2/2016,4/17/2016,,,20.0,307951944,9.78031E+12,A woman heart surgeon's memoir. Originally published in 2010.,HEART MATTERS,Kathy E Magliato
16896,11/18/2017,12/3/2017,,,11.0,1478976713,9.78148E+12,The conservative radio host shares moments when he has experienced glimpses of the divine.,"GOD, FAITH, AND REASON",Michael Savage
16908,11/18/2017,12/3/2017,,,13.0,1616207825,9.78162E+12,A collection of essays that define the historical changes and essential institutions of America to suggest ways to overcome divisions within the country.,WHAT UNITES US,Dan Rather and Elliot Kirschner
16983,7/26/2014,8/10/2014,,,9.0,1594205191,9.78159E+12,The author’s experience as Harper Lee’s neighbor.,THE MOCKINGBIRD NEXT DOOR,Marja Mills
16997,7/26/2014,8/10/2014,,,11.0,307453294,9.78031E+12,The British ruse that employed a corpse to fool the Nazis about the invasion of Sicily.,OPERATION MINCEMEAT,Ben Macintyre
17009,7/26/2014,8/10/2014,,,13.0,62311239,9.78006E+12,"A view of how the family attained, lost and regained political power, from an editor of The Weekly Standard.","CLINTON, INC.",Daniel Halper
17048,7/26/2014,8/10/2014,,,19.0,62218336,9.78006E+12,"How to solve problems creatively, from the authors of “Freakonomics.”",THINK LIKE A FREAK,Steven D Levitt and Stephen J Dubner
17054,7/26/2014,8/10/2014,,,20.0,1497640199,9.7815E+12,Accounts of 12 Wall Street episodes that illuminate corporate and financial life in America.,BUSINESS ADVENTURES,John Brooks
17076,8/20/2016,9/4/2016,,,3.0,1630060585,9.78163E+12,The political strategist offers a game plan for how to defeat Hillary Clinton.,ARMAGEDDON,Dick Morris and Eileen McGann
17108,8/20/2016,9/4/2016,,,8.0,1455568872,9.78146E+12,A former Secret Service officer claims to have witnessed scandalous behavior by the Clintons.,CRISIS OF CHARACTER,Gary J Byrne with Grant M Schmidt
17114,8/20/2016,9/4/2016,,,9.0,1621573478,9.78162E+12,The conservative author and pundit warns of disaster if Hillary Clinton is elected president.,HILLARY'S AMERICA,Dinesh D'Souza
17120,8/20/2016,9/4/2016,,,10.0,385536712,9.78039E+12,"The story of Patty Hearst's kidnapping in 1974 by the Symbionese Liberation Army, her crimes and her trial.",AMERICAN HEIRESS,Jeffrey Toobin
17126,8/20/2016,9/4/2016,,,11.0,670785970,9.78067E+12,The white poor in American history.,WHITE TRASH,Nancy Isenberg
17152,8/20/2016,9/4/2016,,,15.0,006188507X,9.78006E+12,"A memoir of the author's experience at the Federal Medical Center in Carville, La.,where inmates and prison guards shared space with leprosy patients and public health workers. Originally published in 2009.",IN THE SANCTUARY OF OUTCASTS,Neil White
17158,8/20/2016,9/4/2016,,,16.0,1476798850,9.78148E+12,The author says progressive politicians gain power and control by exploiting Americans' fears.,LIARS,Glenn Beck
17164,8/20/2016,9/4/2016,,,17.0,1501132474,9.7815E+12,"A finalist on Season 18 of “The Bachelor,” later the star of Season 10 of “The Bachelorette,” talks about her experience.",IT'S NOT OKAY,Andi Dorfman
17293,5/26/2018,6/10/2018,,,15.0,1627794247,9.78163E+12,A New York Times journalist details the career and struggles of the actor and comedian Robin Williams.,ROBIN,Dave Itzkoff
17365,6/8/2019,6/23/2019,,,12.0,316480932,9.78032E+12,The Pulitzer Prize-winning columnist describes what he considers to be threats to conservatism.,THE CONSERVATIVE SENSIBILITY,George F Will
17389,7/23/2016,8/7/2016,Combined Print & E-Book Nonfiction,15.0,1.0,1501132849,9.7815E+12,"Personal essays, mostly humorous by the YouTube celebrity.",IT GETS WORSE,Shane Dawson
17463,7/23/2016,8/7/2016,,,13.0,1455531189,9.78146E+12,Humorous essays on being a woman by the head writer of “Inside Amy Schumer.”,YOU'LL GROW OUT OF IT,Jessi Klein
17469,7/23/2016,8/7/2016,,,14.0,1250106222,9.78125E+12,A retired general proposes a plan to defeat radical Islamist terrorism.,THE FIELD OF FIGHT,Michael T Flynn and Michael Ledeen
17483,7/23/2016,8/7/2016,,,16.0,1501147625,9.7815E+12,"In a follow-up to ""A Stolen Life,"" Dugard, who was kidnapped as a child and held for 18 years, describes her adjustment to a new life.",FREEDOM,Jaycee Dugard
17489,7/23/2016,8/7/2016,,,17.0,1250112508,9.78125E+12,The Fox News Channel personality describes nine key American virtues that he maintains are under attack by President Obama and Hillary Clinton.,WAKE UP AMERICA,Eric Bolling
17523,2/27/2016,3/13/2016,,,2.0,1594206562,9.78159E+12,A former C.I.A. director defends his policies.,PLAYING TO THE EDGE,Michael V Hayden
17529,2/27/2016,3/13/2016,,,3.0,1101902752,9.7811E+12,The mother of one of the Columbine shooters wrestles with her grief and guilt and discusses how parents can become more aware of the signs of mental illness in teenagers.,A MOTHER'S RECKONING,Sue Klebold
17541,2/27/2016,3/13/2016,,,5.0,1628721111,9.78163E+12,The relationship between Jack and Bobby. Originally published in 1999.,THE KENNEDY BROTHERS,Richard D Mahoney
17573,2/27/2016,3/13/2016,,,10.0,525429565,9.78053E+12,"A Wharton School professor argues that innovators are made, not born, and offers suggestions for how to become one.",ORIGINALS,Adam Grant
17593,2/27/2016,3/13/2016,,,13.0,61940577,9.78006E+12,Theodore Roosevelt's crusade for conservation. Originally published in 2009.,THE WILDERNESS WARRIOR,Douglas Brinkley
17625,2/27/2016,3/13/2016,,,18.0,1101967803,9.7811E+12,"The life story of a leader in the Black Muslim movement and his views on racism in American society. Read by Laurence Fishburne. 16 hours, 52 minutes unabridged.",THE AUTOBIOGRAPHY OF MALCOLM X,as told to Alex Haley
17631,2/27/2016,3/13/2016,,,19.0,006244428X,9.78006E+12,"An Arizona prosecutor describes building the case against Jodi Arias, who was found guilty of murdering her ex-boyfriend, Travis Alexander, in 2013.",CONVICTION,Juan Martinez
17637,2/27/2016,3/13/2016,,,20.0,62035037,9.78006E+12,"The story of George Scovell, whose decoding of enemy communications was pivotal in the British victory over Napoleon. Originally published in 2002.",THE MAN WHO BROKE NAPOLEON'S CODES,Mark Urban
17789,3/28/2015,4/12/2015,,,8.0,802198759,9.7808E+12,"A history of the king’s serial marriages, from Catherine of Aragon to Catherine Parr; first published in 1991.",THE SIX WIVES OF HENRY VIII,Alison Weir
17821,3/28/2015,4/12/2015,,,13.0,62333933,9.78006E+12,The author of “Infidel” and “Nomad” argues that fundamental doctrines of Islam must change for it to be compatible with democracy.,HERETIC,Ayaan Hirsi Ali
17833,3/28/2015,4/12/2015,,,15.0,62008560,9.78006E+12,The unexpected benefits of defying logic at work and at home.,THE UPSIDE OF IRRATIONALITY,Dan Ariely
17839,3/28/2015,4/12/2015,,,16.0,1455532703,9.78146E+12,The New York Times columnist urges students and their parents to give up the high-stakes competition for Ivy League admission and consider other types of schools and other measures of success.,WHERE YOU GO IS NOT WHO YOU'LL BE,Frank Bruni
17857,3/28/2015,4/12/2015,,,19.0,399174060,9.7804E+12,"A memoir by the ESPN anchor and commentator, who died of cancer in January 2015.",EVERY DAY I FIGHT,Stuart Scott with Larry Platt
17863,3/28/2015,4/12/2015,,,20.0,1476785074,9.78148E+12,,WHAT COMES NEXT AND HOW TO LIKE IT,Abigail Thomas
17869,8/29/2020,9/13/2020,Combined Print & E-Book Nonfiction,15.0,1.0,1984855026,9.78198E+12,"The Pulitzer Prize-winning biographer creates a portrait of Representative John Lewis, the late civil rights leader and congressman for Georgia’s Fifth Congressional District.",HIS TRUTH IS MARCHING ON,Jon Meacham
17875,8/29/2020,9/13/2020,,,2.0,1982142448,9.78198E+12,The CNN anchor and chief media correspondent examines the inner workings of Fox News and its relationship with President Trump.,HOAX,Brian Stelter
17949,8/29/2020,9/13/2020,,,14.0,802128815,9.7808E+12,"A collection of observational essays by the nature writer on themes of captivity, immigration and freedom.",VESPER FLIGHTS,Helen Macdonald
17989,9/24/2016,10/9/2016,,,5.0,385535732,9.78039E+12,"The young Winston Churchill’s adventures in Africa during the Boer War, including an escape from captivity in 1899.",HERO OF THE EMPIRE,Candice Millard
18025,9/24/2016,10/9/2016,,,11.0,812993624,9.78081E+12,"A memoir by a “Saturday Night Live” alumnus, a onetime ""Weekend Update: anchor.",BASED ON A TRUE STORY,Norm Macdonald
18031,9/24/2016,10/9/2016,,,12.0,1501141023,9.7815E+12,The threat to the United States of shariah law and the dangers of Islamist radicalism.,UNHOLY ALLIANCE,Jay Sekulow
18069,9/24/2016,10/9/2016,,,18.0,150112515X,9.7815E+12,A memoir by the wife of the basketball star Magic Johnson.,BELIEVING IN MAGIC,Cookie Johnson with Denene Millner
18156,12/1/2018,12/16/2018,,,11.0,1546076220,9.78155E+12,The authors of “Let Trump Be Trump” give their perspectives on the president’s foes.,TRUMP'S ENEMIES,Corey R Lewandowski and David N Bossie
18199,11/21/2020,12/6/2020,,,3.0,1797205099,9.7818E+12,The country music icon offers insights on 175 of her songs.,"DOLLY PARTON, SONGTELLER",Dolly Parton with Robert K Oermann
18205,11/21/2020,12/6/2020,,,4.0,1250265614,9.78125E+12,The actor discusses the challenges he has faced with Parkinson’s disease and other setbacks that caused him to reassess his outlook.,NO TIME LIKE THE FUTURE,Michael J Fox
18211,11/21/2020,12/6/2020,,,5.0,62962752,9.78006E+12,The host of the Food Network show “The Pioneer Woman” shares stories on motherhood and marriage.,FRONTIER FOLLIES,Ree Drummond
18241,11/21/2020,12/6/2020,,,10.0,1250625084,9.78125E+12,A style journalist looks at the fashion of four members of the British royal family.,HRH,Elizabeth Holmes
18247,11/21/2020,12/6/2020,,,11.0,316628247,9.78032E+12,A collection of the humorist’s essays including “Me Talk Pretty One Day” and “A Guy Walks Into a Bar Car.”,THE BEST OF ME,David Sedaris
18254,11/21/2020,12/6/2020,,,12.0,1250800463,9.78125E+12,A look at some questions and concepts needed to address systemic racism.,UNCOMFORTABLE CONVERSATIONS WITH A BLACK MAN,Emmanuel Acho
18260,11/21/2020,12/6/2020,,,13.0,62997459,9.78006E+12,The Pulitzer Prize-winning journalist explains the influence of the ancient Greeks and Romans on the thinking of America’s founding fathers.,FIRST PRINCIPLES,Thomas E Ricks
18284,4/21/2018,5/6/2018,,,2.0,62802186,9.78006E+12,The former secretary of state examines the legacy of fascism in the 20th century and its potential revival.,FASCISM: A Warning,Madeleine Albright with Bill Woodward
18303,4/21/2018,5/6/2018,,,5.0,1538728753,9.78154E+12,"Details of the 2016 presidential election, with an emphasis on Russia's possible involvement.",RUSSIAN ROULETTE,Michael Isikoff and David Corn
18335,4/21/2018,5/6/2018,,,9.0,525520104,9.78053E+12,"An exploration of the history, politics and economics of the Lone Star State.",GOD SAVE TEXAS,Lawrence Wright
18347,4/21/2018,5/6/2018,,,11.0,1630061026,9.78163E+12,"The conservative commentator describes a secret conspiracy to undermine the Trump presidency. From the author of ""The Obama Nation.""",KILLING THE DEEP STATE,Jerome R Corsi
18353,4/21/2018,5/6/2018,,,12.0,1501126423,9.7815E+12,A deeper look at the personal and professional triumphs and disasters of the champion golfer.,TIGER WOODS,Jeff Benedict and Armen Keteyian
18359,4/21/2018,5/6/2018,,,13.0,1538747359,9.78154E+12,A biography of the actress and fiancée of Prince Harry.,MEGHAN,Andrew Morton
18371,4/21/2018,5/6/2018,,,15.0,62837877,9.78006E+12,A star of “This Is Us” describes her journey toward self-acceptance.,THIS IS ME,Chrissy Metz
18377,2/20/2021,3/7/2021,Combined Print & E-Book Nonfiction,15.0,1.0,385546130,9.78039E+12,"A prescription for what business, governments and individuals can do to work toward zero emissions.",HOW TO AVOID A CLIMATE DISASTER,Bill Gates
18389,2/20/2021,3/7/2021,,,3.0,525509569,9.78053E+12,The chair of the board of the racial justice organization Color of Change analyzes the impact of racism on the economy.,THE SUM OF US,Heather McGhee
18449,2/20/2021,3/7/2021,,,13.0,525560688,9.78053E+12,"In 2014, a group of all-female Kurdish militia faced off against ISIS in a small town in Syria.",THE DAUGHTERS OF KOBANI,Gayle Tzemach Lemmon
18455,2/20/2021,3/7/2021,,,14.0,1984880330,9.78198E+12,The companion book to the PBS series that provides a look at five centuries of the meaning and functions of the Black church in America.,THE BLACK CHURCH,"Henry Louis Gates, Jr"
18690,1/14/2017,1/29/2017,,,6.0,399173595,9.7804E+12,"Recollections of life on the set of the first Star Wars movie by the actress and writer, who died in December.",THE PRINCESS DIARIST,Carrie Fisher
18702,1/14/2017,1/29/2017,,,8.0,143915371X,9.78144E+12,A memoir based on Fisher’s one-woman autobiographical show. Originally published in 2008.,WISHFUL DRINKING,Carrie Fisher
18720,1/14/2017,1/29/2017,,,11.0,,9.78006E+12,"A second memoir by the actress, singer and dancer presents stories about her show-business friends, her man and money troubles, and her children. ",UNSINKABLE,Debbie Reynolds and Dorian Hannaway
18744,1/14/2017,1/29/2017,,,15.0,1610397843,9.78161E+12,A call for economic policies that will promote economic growth by encouraging Main Street capitalism (small businesses and start-ups) rather than Wall Street capitalism.,THE GREAT EQUALIZER,David M Smick
18762,1/14/2017,1/29/2017,,,18.0,307701646,9.78031E+12,A science writer warns of sugar’s dangers.,CASE AGAINST SUGAR,Gary Taubes
18780,10/16/2021,10/31/2021,Combined Print & E-Book Nonfiction,15.0,1.0,059323152X,9.78059E+12,The congressman from California describes risks to our democracy and the resurgence of autocracy.,MIDNIGHT IN WASHINGTON,Adam Schiff
18786,10/16/2021,10/31/2021,,,2.0,63039540,9.78006E+12,The Fox News chief political anchor recounts challenges faced by Ulysses S. Grant.,TO RESCUE THE REPUBLIC,Bret Baier with Catherine Whitney
18798,10/16/2021,10/31/2021,,,4.0,006306524X,9.78006E+12,"The Howard brothers credit their success in Hollywood to their Midwestern parents, Rance and Jean.",THE BOYS,Ron Howard and Clint Howard
18804,10/16/2021,10/31/2021,,,5.0,1982182911,9.78198E+12,The Washington Post journalists detail the dangers and challenges during the transition to the Biden presidency.,PERIL,Bob Woodward and Robert Costa
18810,10/16/2021,10/31/2021,,,6.0,759554269,9.78076E+12,A collection of stories from people working in big-city and small-town hospitals.,E.R. NURSES,James Patterson and Matt Eversmann with Chris Mooney
18816,10/16/2021,10/31/2021,,,7.0,62964615,9.78006E+12,The CNN host and descendant of the Vanderbilt family charts the rise and fall of this American dynasty.,VANDERBILT,Anderson Cooper and Katherine Howe
18828,10/16/2021,10/31/2021,,,9.0,1631498231,9.78163E+12,The ESPN reporter traces the inner workings of the New England Patriots and their influence on the N.F.L. over two decades.,IT'S BETTER TO BE FEARED,Seth Wickersham
18852,10/16/2021,10/31/2021,,,13.0,358574315,9.78036E+12,The foreign policy expert traces her life from being a coal miner’s daughter in northern England to her testimony in the first impeachment inquiry of former President Trump.,THERE IS NOTHING FOR YOU HERE,Fiona Hill
18864,10/16/2021,10/31/2021,,,15.0,1101984694,9.7811E+12,The actor and humorist shares stories and observations from three quests taken in the outdoors.,WHERE THE DEER AND THE ANTELOPE PLAY,Nick Offerman
18912,4/25/2020,5/10/2020,,,8.0,1982144890,9.78198E+12,"The actor recalls his career highlights, romances and the toll cancer has taken on his voice.",I'M YOUR HUCKLEBERRY,Val Kilmer
18977,5/16/2015,5/31/2015,,,3.0,1400069696,9.7814E+12,The journalist describes the year following his diagnosis with multiple myeloma.,LUCKY LIFE INTERRUPTED,Tom Brokaw
19009,5/16/2015,5/31/2015,,,8.0,1101903821,9.7811E+12,"A memoir of life, often uproarious, with the comedian Joan Rivers, written by her daughter.",THE BOOK OF JOAN,Melissa Rivers
19063,5/16/2015,5/31/2015,,,16.0,1455585661,9.78146E+12,A high-level C.I.A. officer assesses the agency’s counterterrorism successes and failures.,THE GREAT WAR OF OUR TIME,Michael Morell with Bill Harlow
19075,5/16/2015,5/31/2015,,,18.0,316247766,9.78032E+12,"The photographer’s thoughts on art, photography, family and the South.",HOLD STILL,Sally Mann
19087,5/16/2015,5/31/2015,,,20.0,038534497X,9.78039E+12,"The story of Catherine Wendell and her husband, who became the sixth Earl of Carnarvon.","LADY CATHERINE, THE EARL, AND THE REAL DOWNTON ABBEY",the Countess of Carnarvon
19099,2/17/2018,3/4/2018,,,2.0,525427570,9.78053E+12,"A case for using reason, science and humanism to counter pessimistic views of Western civilization.",ENLIGHTENMENT NOW,Steven Pinker
19112,2/17/2018,3/4/2018,,,4.0,316412651,9.78032E+12,"The story of Aaron Hernandez, the New England Patriots tight end convicted of first-degree murder.",ALL-AMERICAN MURDER,James Patterson and Alex Abramovich with Mike Harvkey
19119,2/17/2018,3/4/2018,,,5.0,399592067,9.7804E+12,A divinity school professor examines her tacit beliefs when she learns she has late-stage colon cancer.,EVERYTHING HAPPENS FOR A REASON,Kate Bowler
19125,2/17/2018,3/4/2018,,,6.0,451498143,9.78045E+12,"An oral history of the creation and development of the series ""The Wire.""",ALL THE PIECES MATTER,Jonathan Abrams
19152,2/17/2018,3/4/2018,,,10.0,163286830X,9.78163E+12,"The journalist describes nine causes of depression and anxiety, and offers potential solutions.",LOST CONNECTIONS,Johann Hari
19164,2/17/2018,3/4/2018,,,12.0,1455566977,9.78146E+12,The story of the American socialite whose relationship with King Edward VIII forced him to abdicate his throne.,WALLIS IN LOVE,Andrew Morton
19176,2/17/2018,3/4/2018,,,14.0,735210624,9.78074E+12,Research from several fields reveals the ideal time to make small decisions and big life changes.,WHEN,Daniel H Pink
19241,9/26/2015,10/11/2015,,,9.0,,9.78147E+12,"An account of Hitler's private life by a soldier who was part of his SS bodyguard, and died in 2013.",HITLER'S LAST WITNESS,Rochus Misch and others
19247,9/26/2015,10/11/2015,,,10.0,1439114080,9.78144E+12,"A pivotal year that saw D-Day, the liberation of Paris, Franklin Roosevelt’s re-election and the Battle of the Bulge.",1944,Jay Winik
19266,9/26/2015,10/11/2015,,,13.0,1610395530,9.78161E+12,"The consequences of the Boston F.B.I.'s protection of James (Whitey) Bulger, the head of the Irish mob. Originally published in 2000; now a movie.",BLACK MASS,Dick Lehr and Gerald O'Neill
19272,9/26/2015,10/11/2015,,,14.0,62346229,9.78006E+12,Bipolar disorder drove a former Olympic runner to become a high-priced Las Vegas escort until she received treatment.,FAST GIRL,Suzy Favor Hamilton with Sarah Tomlinson
19278,9/26/2015,10/11/2015,,,15.0,1501126121,9.7815E+12,The talk-radio host looks to Muslim teachings for the roots of Islamic extremism.,IT IS ABOUT ISLAM,Glenn Beck
19308,9/26/2015,10/11/2015,,,20.0,1601427557,9.7816E+12,A comic turned pastor documents encounters with grace and finding divinity in unlikely places.,ACCIDENTAL SAINTS,Nadia Bolz-Weber
